,track_uri,popularity,name,danceability,energy,speechiness,instrumentalness,tempo,sentiment,negative,positive,neutral,lyrics
37,0ZPHHXmmW3nVoDBe3YUdmm,0,The Middle,0.634,0.85,0.0549,0.0,162.166,-0.9767,0.1,0.021,0.879,"[Verse 1: Maren Morris]
Take a seat
Right over there, sat on the stairs
Stay or leave
The cabinets are bare, and I'm unaware
Of just how we got into this mess, got so aggressive
I know we meant all good intentions

[Pre-Chorus: Maren Morris]
So pull me closer
Why don't you pull me close?
Why don't you come on over?
I can't just let you go

[Chorus: Maren Morris]
Oh baby, why don't you just meet me in the middle?
I'm losing my mind just a little
So why don't you just meet me in the middle?
In the middle
Baby, why don't you just meet me in the middle?
I'm losing my mind just a little
So why don't you just meet me in the middle?
In the middle

[Verse 2: Maren Morris]
Ohh, take a step
Back for a minute, into the kitchen
Floors are wet
And taps are still runnin', dishes are broken
How did we get into this mess? Got so aggressive
I know we meant all good intentions
[Pre-Chorus: Maren Morris]
So pull me closer
Why don't you pull me close?
Why don't you come on over?
I can't just let you go

[Chorus: Maren Morris]
Oh baby, why don't you just meet me in the middle?
I'm losing my mind just a little
So why don't you just meet me in the middle?
In the middle

[Bridge: Maren Morris]
Lookin' at you, I can't lie
Just pourin' out admission
Regardless of my objection, oh, oh
And it's not about my pride
I need you on my skin
Just come over, pull me in, just

[Chorus: Maren Morris]
Oh, baby, why don't you just meet me in the middle?
I'm losing my mind just a little
So why don't you just meet me in the middle?
In the middle, no no
Baby, why don't you just meet me in the middle?
Oh yeah, I'm losing my mind just a little
So why don't you just meet me in the middle?
Oh, in the middle
Baby-y-y, why don't you just meet me in the middle, baby?
I'm losing my mind just a little
So why don't you just meet me in the middle, middle?
In the middle, middle48EmbedShare URLCopyEmbedCopy"
38,1mqlc0vEP9mU1kZgTi6LIQ,0,September,0.693,0.911,0.0305,0.000107,125.895,0.9916,0.0,0.144,0.856,"[Verse 1]
Do you remember
The 21st night of September?
Love was changin' the minds of pretenders
While chasin' the clouds away
Our hearts were ringin'
In the key that our souls were singin'
As we danced in the night, remember
How the stars stole the night away, oh, yeah

[Chorus]
Hey, hey, hey
Ba-dee-ya, say, do you remember?
Ba-dee-ya, dancin' in September
Ba-dee-ya, never was a cloudy day

[Post-Chorus]
Ba-du-da, ba-du-da, ba-du-da, ba-du
Ba-du-da, ba-du, ba-du-da, ba-du
Ba-du-da, ba-du, ba-du-da

[Verse 2]
My thoughts are with you
Holdin' hands with your heart to see you
Only blue talk and love, remember
How we knew love was here to stay
Now December
Found the love that we shared in September
Only blue talk and love, remember
The true love we share today
[Chorus]
Hey, hey, hey
Ba-dee-ya, say, do you remember?
Ba-dee-ya, dancin' in September
Ba-dee-ya, never was a cloudy day
There was a—
Ba-dee-ya (Dee-ya, dee-ya), say, do you remember?
Ba-dee-ya (Dee-ya, dee-ya), dancin' in September
Ba-dee-ya (Dee-ya, dee-ya), golden dreams were shiny days

[Bridge]
The bell was ringin', oh, oh
Our souls were singin'
Do you remember never a cloudy day? Yow

[Chorus]
There was a
Ba-dee-ya (Dee-ya, dee-ya), say, do you remember?
Ba-dee-ya (Dee-ya, dee-ya), dancin' in September
Ba-dee-ya (Dee-ya, dee-ya), never was a cloudy day
And we'll say
Ba-dee-ya (Dee-ya, dee-ya), say, do you remember?
Ba-dee-ya (Dee-ya, dee-ya), dancin' in September
Ba-dee-ya (Dee ya, dee-ya),  golden dreams were shiny days

[Outro]
Ba-dee-ya, dee-ya, dee-ya
Ba-dee-ya, dee-ya, dee-ya
Ba-dee-ya, dee-ya, dee-ya, dee-ya!
Ba-dee-ya, dee-ya, dee-ya
Ba-dee-ya, dee-ya, dee-ya
Ba-dee-ya, dee-ya, dee-ya, dee-ya!105EmbedShare URLCopyEmbedCopy"
39,3tSi6iFO9yLGIYIqMEgjC9,61,I Want You Back,0.67,0.584,0.034,0.00614,98.185,0.9864,0.099,0.131,0.77,"[Intro: Michael Jackson]
Uh-huh huh huh huh
Let me tell ya now
Uh-huh

[Verse 1: Michael Jackson]
When I had you to myself, I didn't want you around
Those pretty faces always made you stand out in a crowd
But someone picked you from the bunch, one glance was all it took
Now it's much too late for me to take a second look

[Chorus: Michael Jackson & Jackson 5]
Oh, baby, give me one more chance (To show you that I love you)
Won't you please let me (Back in your heart)
Oh, darlin', I was blind to let you go (Let you go, baby)
But now since I see you in his arms (I want you back)

[Post-Chorus: Michael Jackson & Jackson 5]
Yes, I do now (I want you back)
Ooh, ooh, baby (I want you back)
Yeah, yeah, yeah, yeah (I want you back)
Na, na, na, na

[Verse 2: Michael Jackson]
Tryin' to live without your love is one long sleepless night
Let me show you, girl, that I know wrong from right
Every street you walk on I leave tear stains on the ground
Following the girl I didn't even want around
Let me tell you now
[Chorus: Michael Jackson & Jackson 5]
Oh, baby, all I need is one more chance (To show you that I love you)
Won't you please let me (Back in your heart)
Oh, darlin', I was blind to let you go (Let you go, baby)
But now since I see you in his arms, uh-huh

[Bridge: Michael Jackson]
A buh buh buh buh
A buh buh buh buh, all I want
A buh buh buh buh, all I need
A buh buh buh buh, all I want
A buh buh buh buh, all I need

[Chorus 2: Jermaine Jackson, Michael Jackson & Jackson 5]
Oh, just one more chance
To show you that I love you
Baby! Baby!
Baby! Baby!
Baby! Baby!
I want you back

[Jackie Jackson & Jackson 5]
Forget what happened then
I want you back

[Jermaine Jackson]
Let me live again
[Chorus 3: Michael Jackson & Jackson 5]
Oh baby, I was blind to let you go
But now since I see you in his arms
I want you back

[Jackie Jackson]
Spare me of this 'cause

[Jermaine Jackson]
Gimme back what I lost

[Outro: Michael Jackson and Jermaine Jackson]
Oh baby I need one more chance ha
I tell ya that I love you
(Baby!) Oh! (Baby!) Oh! (Baby!) Oh!
I want you back!

[Jackie Jackson]
Forget what happened then

[Michael Jackson]
I want you back!

[Jermaine Jackson]
And let me live again
[Michael Jackson]
Oh, I want you back! Ha!30EmbedShare URLCopyEmbedCopy"
40,1puEUilaw5RSbi3AYnkF8K,51,Steal My Sunshine,0.412,0.829,0.529,0.0,191.476,0.9867,0.185,0.242,0.573,"[Intro: Tim & Matt]
Hey, Matt
Yeah, Tim?
Hey, you talked to Marc lately?
Uh, haven't really talked to him but he looks pretty, uh, down
""He looks pretty, uh, down?""
Yeah, well, maybe we should cheer him up then
What do you, uh, suppose we should do?
Well, does he like butter tarts?

[Verse 1: Marc]
I was lying on the grass of Sunday morning of last week
Indulging in my self-defeat
My mind was thugged, all laced and bugged, all twisted, wrong and beat
A comfortable three feet deep
Now the fuzzy stare from not being there on a confusing morning week
Impaired my tribal lunar speak
And of course you can't become if you only say what you would have done
So I missed a million miles of fun

[Chorus: Marc & (Sharon)]
I know it's up for me
(If you steal my sunshine)
Making sure I'm not in too deep
(If you steal my sunshine)
Keeping versed and on my feet
(If you steal my sunshine)
[Spoken: Tim & Chad]
Chad, come here, come here, come here
Wow, look at her
I know
Man, I've never seen Sharon look so bad before
I did once before, but this is pretty bad
Yeah, what do you think she got up to last night?
Well, I... Sharon, I love you!

[Verse 2: Sharon]
I was frying on the bench slide in the park across the street
L-A-T-E-R that week
My sticky paws were into making straws out of big fat slurpy treats
An incredible eight-foot heap
Now the funny glare to pay a gleaming tare in a staring under heat
Involved an under usual feat
And I'm not only among but I invite who I want to come
So I missed a million miles of fun

[Chorus: Marc & (Sharon)]
I know it's up for me
(If you steal my sunshine)
Making sure I'm not in too deep
(If you steal my sunshine)
Keeping versed and on my feet
(If you steal my sunshine)
[Chorus 2: Marc & (Sharon)]
I know it's done for me
(If you steal my sunshine)
Not some and hard to see
(If you steal my sunshine)
Keeping dumb and built to beat
(If you steal my sunshine)

[Outro: Marc & Sharon]
My sunshine, if you steal my sunshine
My sunshine, if you steal my sunshine
My sunshine, if you steal my sunshine
My sunshine, if you steal my sunshine
My sunshine, if you steal my sunshine
My sunshine, if you steal my sunshine
My sunshine, if you steal my sunshine
My sunshine, if you steal my sunshine
My sunshine, if you steal my sunshine11EmbedShare URLCopyEmbedCopy"
41,6hs3SDnbO3f6VQuPO4KBEb,72,Send Me on My Way,0.5,0.681,0.0672,4.01e-05,119.46,0.9972,0.0,0.179,0.821,"[Intro]
On my way, on my way
On my way, on my way

[Verse 1]
I would like to reach out my hand
Oombayseeyou, oombaytellyou to run (On my way, on my way)
You know what they say about the young
Well, pick me up with golden hand
Oombayseeyou, oombaytellyou to run (On my way, on my way)
You know what they say about the young

[Pre-Chorus]
Well, I would like to hold my little hand
And we will run, we will, we will crawl, we will
I would like to hold my little hand
And we will run, we will, we will crawl

[Chorus]
Send me on my way (On my way)
Send me on my way (On my way)
Send me on my way (On my way)
Send me on my way (On my way)
Send me on my way (On my way)
Send me on my way (On my way)
Send me on my way (On my way)
Mm, hmm (On my way)
[Verse 2]
I would like to reach out my hand
Oombayseeyou, oombaytellyou to run (On my way, on my way)
You know what they say about the young​
Now pick me up with golden hand
Oombayseeyou, oombaytellyou to run (On my way, on my way)
You know what they say about the young

[Pre-Chorus]
Well, I would like to hold my little hand
And we will run, we will, we will crawl, we will
I would like to hold my little hand
And we will run, we will, we will crawl

[Chorus]
Send me on my way (On my way)
Send me on my way (On my way)
Send me on my way (On my way)
Mm, hmm, whoo! (On my way)
Ha ha ha

[Pre-Chorus]
Well, I would like to hold my little hand
And we will run, we will, we will crawl, we will
I would like to hold my little hand
And we will run, we will, we will crawl
[Chorus]
Send me on my way
Send me on my way
Send me on my way
On my way
Send me on my way
Send me on my way
Ooh, ooh, ooh, ooh, ooh, ooh, ooh, ooh
(Hey, hey, hey, hey, hey, hey, hey)
On my way
Ooh, ooh, ooh, ooh, ooh, ooh, ooh
(Hey, hey, hey, hey, hey, hey, hey)
On my way

[Outro]
I would like to reach out my hand
Oombayseeyou, oombaytellyou to run (On my way, on my way)
You know what they say about the young
Thank you
Thank you
Thank you very much14EmbedShare URLCopyEmbedCopy"
42,0PDCewmZCp0P5s00bptcdd,73,This Will Be ,0.685,0.623,0.042,0.00234,126.739,-0.9953,0.167,0.085,0.747,"[Produced by Andrew Dawson, Jeff Bhasker, Kanye West, Mike Dean & S1]

[Intro: Kanye West]
I'm living in that 21st century, doing something mean to it
Do it better than anybody you ever seen do it
Screams from the haters got a nice ring to it
I guess every superhero need his theme music

[Chorus: Kanye West]
No one man should have all that power
The clock’s ticking, I just count the hours
Stop tripping, I'm tripping off the power
(21st-century schizoid man)

[Verse 1: Kanye West]
The system broken, the school's closed, the prison's open
We ain't got nothing to lose, motherfucker, we rolling
Huh? Motherfucker, we rolling
With some light-skinned girls and some Kelly Rowlands
In this white man world, we the ones chosen
So goodnight, cruel world, I'll see you in the morning
Huh? I'll see you in the morning
This is way too much, I need a moment

[Chorus: Kanye West]
No one man should have all that power
The clock's ticking, I just count the hours
Stop tripping, I'm tripping off the power
'Til then, fuck that, the world's ours
And they say, and they say
And they say, and they say
And they say, and they say
(21st-century schizoid man)
[Verse 2: Kanye West]
Fuck SNL and the whole cast
Tell them Yeezy said they can kiss my whole ass
More specifically, they can kiss my asshole
I'm an asshole? You niggas got jokes
You short-minded niggas' thoughts is Napoleon
My furs is Mongolian, my ice brought the goalies in
I embody every characteristic of the egotistic
He knows he's so fuckin' gifted
I just needed time alone with my own thoughts
Got treasures in my mind, but couldn't open up my own vault
My childlike creativity, purity, and honesty
Is honestly being crowded by these grown thoughts
Reality is catching up with me
Taking my inner child, I'm fighting for custody
With these responsibilities that they entrusted me
As I look down at my diamond-encrusted piece

[Chorus: Kanye West]
Thinking no one man should have all that power
The clock's ticking, I just count the hours
Stop tripping, I'm tripping off the powder
'Til then, fuck that, the world’s ours
And they say, and they say
And they say, and they say
And they say, and they say
(21st-century schizoid man)
[Verse 3: Kanye West]
Colin Powells, Austin Powers
Lost in translation with a whole fuckin' nation
They say I was the abomination of Obama's nation
Well, that's a pretty bad way to start the conversation
At the end of the day, goddamnit, I'm killing this shit
I know damn well y'all feeling this shit
I don't need your pussy, bitch, I'm on my own dick
I ain't gotta power trip, who you goin' home with?
How Ye doing? I'm survivin'
I was drinkin' earlier, now I'm drivin'
Where the bad bitches, huh? Where you hidin'?
I got the power make your life so excitin'

[Outro: Kanye West & Dwele]
Now this will be a beautiful death
I'm jumping out the window, I'm letting everything go
I'm letting everything go
Mmm, now this will be a beautiful death
I'm jumping out the window, I'm letting everything go
I'm letting everything go
Now this will be a beautiful death
Jumping out the window, letting everything go
Letting everything go
You got the power to let power go?
(21st-century schizoid man)273EmbedShare URLCopyEmbedCopy"
43,0clSHsrHl2irBkObcLEZqS,59,I Love My Country,0.525,0.94,0.065,0.0,140.093,0.9995,0.038,0.385,0.578,"[Intro]
Yeah, baby

[Verse 1]
Out here, ain't nothin' but woods and water
Drop a beer from a stand, catch a fish with a bobber
Drink a beer out the can, liquor out the bottle
How the good Lord intended it
Yes, he did

[Chorus]
I love my country, I love my country
Six strings and fiddles, whiskey from Kentucky
We keep it funky we like how it sounds
Monday to Sunday, yeah, I love my country
Up loud and proud, rollin' into town
Hanging out the window like a Bluetick hound
Ain't sorry, ain't nothin' to be sorry about
I love my country, I love my country up loud

[Verse 2]
Barbecue, steak fries, styrofoam, plate date night
George Strait, singing greats, while we turning up, sitting lake side
That pedal steel, she straight slidin' over here to me
She do that Alabama Shake, like you ain't ever seen
[Chorus]
I love my country, I love my country
Six strings and fiddles, whiskey from Kentucky
We keep it funky, we like how it sounds
Monday to Sunday, yeah, I love my country
Up loud and proud, rollin' into town
Hanging out the window like a Bluetick hound
Ain't sorry, ain't nothin' to be sorry about
I love my country
I love my country up loud
I love my country up loud
I'm talking way up loud

[Bridge]
I like pop, and rock, and rap, I like Skynyrd
And going out downtown when I'm with her
Like driving too fast down a four-lane road
But damn sure nowhere close to the way that

[Chorus]
I love my country, I love my country
Six strings and fiddles, whiskey from Kentucky
We keep it funky, we like how it sounds
Monday to Sunday, yeah, I love my country
Up loud and proud, rollin' into town
Hanging out the window like a Bluetick hound
Ain't sorry, ain't nothin' to be sorry about
I love my country, I love my country up loud (Yeah, baby, ooh)
I love my country up loud, yeah, way up loud
[Outro]
That's a country ass lyric right there, boy
Haha, yee-yee1EmbedShare URLCopyEmbedCopy"
44,2PpruBYCo4H7WOBJ7Q2EwM,81,Hey Ya!,0.727,0.974,0.0664,0.000532,79.526,0.9481,0.08,0.094,0.825,"[Intro: André 3000]
One, two, three, uh!

[Verse 1: André 3000]
My baby don't mess around
Because she loves me so, and this I know for sure (Uh)
But does she really wanna
But can't stand to see me walk out the door? (Ah)
Don't try to fight the feeling
'Cause the thought alone is killing me right now (Uh)
Thank God for Mom and Dad
For sticking two together 'cause we don't know how (C'mon)

[Chorus: André 3000]
Hey ya! Hey ya!
Hey ya! Hey ya!
Hey ya! Hey ya!
Hey ya! Hey ya!

[Verse 2: André 3000]
You think you've got it, oh, you think you've got it
But ""got it"" just don't get it till there's nothing at all (Ah!)
We get together, oh, we get together
But separate's always better when there's feelings involved (Ah)
If what they say is, ""Nothing is forever""
Then what makes, then what makes, then what makes
Then what makes, what makes, what makes love the exception?
So why oh, why oh, why oh, why oh, why oh
Are we so in denial when we know we're not happy here?
Y'all don't wanna hear me, you just wanna dance
[Chorus: André 3000]
Hey ya! (Uh-oh) Hey ya! (Uh-oh)
Don't want to meet your daddy
Hey ya! (Uh-oh)
Just want you in my Caddy (Uh-oh)
Hey ya! (Uh-oh)
Don't want to meet your mama (Uh-oh)
Hey ya! (Uh-oh)
Just want to make you cum-a' (Uh-oh)
Hey ya! (Uh-oh)
I'm, I'm, I'm, I'm just being honest (Uh-oh)
Hey ya!
I'm just being honest

[Bridge 1: André 3000]
Hey, all right now, all right now, fellas (Yeah?)
Now, what's cooler than being cool? (Ice Cold!)
I can't hear ya
I say what's, what's cooler than being cool? (Ice Cold!)
All right, all right, all right, all right, all right, all right, all right, all right
All right, all right, all right, all right, all right, all right
Okay now, ladies (Yeah?)
Now, we gon' break this thing down in just a few seconds
Now, don't have me break this thing down for nothing
Now, I want to see y'all on your baddest behavior
Lend me some sugar, I am your neighbor
Ah, here we go!
[Refrain: André 3000]
Shake it, sh-shake it, shake it, sh-shake it (Uh-oh)
Shake it, sh-shake it, shake it, shake it, sh-shake it (Uh-oh)
Shake it like a Polaroid picture, hey ya!
Shake it, sh-shake it, shake it, sh-shake it
Shake it, shake it (Okay), shake it, sugar
Shake it like a Polaroid picture

[Bridge 2: André 3000]
Now, all the Beyoncés and Lucy Lius
And baby dolls, get on the floor
You know what to do, oh, you know what to do
You know what to do

[Chorus: André 3000]
Hey ya! (Uh-oh) Hey ya! (Uh-oh)
Hey ya! (Uh-oh) Hey ya! (Uh-oh, hey ya!)
Hey ya! (Uh-oh) Hey ya! (Oh, oh, uh-oh)
Hey ya! (Uh-oh) Hey ya! (Uh-oh)
Hey ya! Hey ya!135EmbedShare URLCopyEmbedCopy"
45,7HW5WIw7ZgZORCzUxv5gW5,78,Don't Go Breaking My Heart,0.729,0.844,0.0344,2.87e-06,131.459,0.9804,0.031,0.094,0.874,"[Verse 1: Nick Carter]
I got mixed emotions
Did I finally find me a river
That could lead me out to the ocean?
'Cause I've only ever known the kind of love
That leaves you battered and broken
So forgive me for my mixed emotions, yeah yeah

[Pre-Chorus: All]
I'm not that kind of person
Who can fall in and out of love with you
That's not what love's supposed to do
I'm not that kind of person
Who can fall in and out of love with you
That's not what love's supposed to do

[Chorus: All]
Baby, don't go breaking my heart, breaking my heart
Baby, don't go breaking my heart, breaking my heart
'Cause it's the only one I've got
'Cause it's the only one I've got

[Verse 2: AJ McLean]
Am I being too open?
'Cause I told you everything I have to say
And now we're having a moment
Does it make you wanna pack up all your things
And drive away like you stole it?
Just forgive me if I'm being too open
No no no no, yeah yeah yeah
[Pre-Chorus: All]
I'm not that kind of person
Who can fall in and out of love with you
That's not what love's supposed to do
(What love's supposed to do)
I'm not that kind of person
Who can fall in and out of love with you
That's not what love's supposed to do

[Chorus: All]
Baby, don't go breaking my heart, breaking my heart
Baby, don't go breaking my heart, breaking my heart
'Cause it's the only one I've got
'Cause it's the only one I've got
Baby, don't go breaking my heart, breaking my heart
Baby, don't go breaking my heart, breaking my heart
'Cause it's the only one I've got
'Cause it's the only one I've got

[Bridge: Nick Carter]
I've been broken, I've been bruised
But now I'm all in 'cause of you
So if you're gonna love me, love me right, yeah
But if you're gonna be someone that hurts somebody just for fun
Then do it to a heart that isn't mine
[Chorus: All]
Baby, don't go breaking my heart, breaking my heart (Woo)
Baby, don't go breaking my heart, breaking my heart (Don't, don't, don't)
'Cause it's the only one I've got (Yeah)
'Cause it's the only one I've got (Yeah)
Baby, don't go breaking my heart, breaking my heart
Baby, don't go breaking my heart, breaking my heart
'Cause it's the only one I've got
It's the only one, it's the only one I got
'Cause it's the only one I've got (Got, oh)
Baby, don't go9EmbedShare URLCopyEmbedCopy"
46,1Cv1YLb4q0RzL6pybtaMLo,80,Sunday Best,0.878,0.525,0.0578,0.0,112.022,0.9988,0.029,0.387,0.585,"[Intro: Forrest]
Good, feeling good

[Chorus: Forrest]
Ayy, feeling good, like I should
Went and took a walk around the neighborhood
Feeling blessed, never stressed
Got that sunshine on my Sunday best (Yeah, ayy, ayy)

[Verse 1: Forrest]
Every day can be a better day, despite the challenge
All you gotta do is leave it better than you found it
It's gonna get difficult to stand, but hold your balance
I just say whatever 'cause there is no way around it 'cause

[Pre-Chorus: Forrest]
Everyone falls down sometimes
But you just gotta know it'll all be fine
It's okay, uh-huh-huh, uh
It's okay, it's okay

[Chorus: Forrest]
Ayy, feeling good like I should
Went and took a walk around the neighborhood
Feeling blessed, never stressed
Got that sunshine on my Sunday best (Ayy)
[Verse 2: Forrest]
Some days you wake up and nothing works, you feel surrounded
Gotta give your feet some gravity to get you grounded
Keep good things inside your ears just like the waves and sound did
And just say whatever 'cause there is no way around it

[Pre-Chorus: Forrest]
Everyone falls down sometimes
But you just gotta know it'll all be fine
It's okay, uh-huh-huh, uh
It's okay, it's okay

[Chorus: Forrest]
Ayy, feeling good, like I should
Went and took a walk around the neighborhood
Feeling blessed, never stressed
Got that sunshine on my Sunday best
Ayy, feeling good, like I should
Went and took a walk around the neighborhood
Feeling blessed, never stressed
Got that sunshine on my Sunday best23EmbedShare URLCopyEmbedCopy"
47,3qI94hINNNeb4S7xQi18lS,72,Blame It on the Boogie,0.774,0.641,0.0799,0.0,113.256,0.9989,0.081,0.278,0.641,"[Intro: Michael Jackson]
Hee-hee-hee-hee!

[Verse 1: Michael Jackson]
My baby's always dancin' and it wouldn't be a bad thing
But I don't get no lovin' and that's no lie
We spent the night in Frisco at every kinda disco
From that night I kissed our love goodbye

[Hook: The Jacksons]
Don't blame it on the sunshine
Don't blame it on the moonlight
Don't blame it on the good times
Blame it on the boogie
Don't blame it on the sunshine
Don't blame it on the moonlight
Don't blame it on the good times
Blame it on the boogie

[Verse 2: Michael Jackson]
That nasty boogie bugs me, but somehow it has drugged me
Spellbound rhythm gets me on my feet
I've changed my life completely, I've seen the lightning leave me
And my baby just can't take her eyes off me

[Hook""The Jacksons]
Don't blame it on the sunshine
Don't blame it on the moonlight
Don't blame it on the good times
Blame it on the boogie (Woo!)
Don't you blame it on the sunshine
Don't blame it on the moonlight
Don't blame it on the good times
Blame it on the boogie
[Break 1: The Jacksons]
I just can't, I just can't
I just can't control my feet
I just can't, I just can't (Yeah)
I just can't (Woo!) control my feet
I just can't, I just can't
I just can't control my feet
I just can't, I just can't
I just can't control my feet

[Hook: The Jacksons]
Sunshine
Don't blame it on the moonlight
Don't blame it on the good times
Blame it on the boogie
Don't blame it on the sunshine
Don't blame it on the moonlight
Don't - on the good times
Blame it on the boogie

[Verse 3: Michael Jackson]
This magic music grooves me, that dirty rhythm fools me
The devil's gotten to me through this dance
I'm full of funky fever, a fire burns inside me
Boogie's got me in a super trance
[Hook: The Jacksons]
Don't blame it on the sunshine
Don't blame it on the moonlight
Don't blame it on the good times
Blame it on the boogie
Don't you blame it - sunshine
Don't blame it on the moonlight
Don't blame it on the good times
Blame it on the boogie

[Break: The Jacksons]
Aaow! (Sunshine)
Hoo! (Moonlight)
Yeah (Good times)
Mmm (Boogie)

You just gotta (Sunshine)
Yeah (Moonlight)
(Good times)
Good times (Boogie)

[Outro]
Don't you blame it (Sunshine)
You just gotta (Moonlight)
You just wanna (Good times)
Yeah, oh (Boogie)
Blame it on yourself (Sunshine)
Ain't nobody's fault (Moonlight)
But yours and that boogie (Good times)
All night long (Boogie)

Can't stop that boogie (Sunshine)
Ain't nobody's fault (Moonlight)
But yours and that boogie (Good times)
Dancin' all night long (Boogie)

Blame it on yourself (Sunshine)
Ain't nobody's fault (Moonlight)
But yours and that boogie (Good times)
Boogie, boogie, boogie, yeah (Boogie)5EmbedShare URLCopyEmbedCopy"
