,track_uri,popularity,name,danceability,energy,speechiness,instrumentalness,tempo,sentiment,negative,positive,neutral,lyrics
48,2Gy7qnDwt8Z3MNxqat4CsK,72,Wouldn't It Be Nice ,0.392,0.629,0.0335,3.76e-06,124.511,0.9798,0.068,0.15,0.782,"[Verse 1: Brian Wilson]
Wouldn't it be nice if we were older?
Then we wouldn't have to wait so long
And wouldn't it be nice to live together
In the kind of world where we belong?
[Chorus: Brian Wilson]
You know it's gonna make it that much better
When we can say goodnight and stay together

[Verse 2: Brian Wilson]
Wouldn't it be nice if we could wake up
In the morning when the day is new?
After having spent the day together
Hold each other close the whole night through

[Chorus: Brian Wilson]
But happy times together we've been spending
I wish that every kiss was never-ending
Oh, wouldn't it be nice?

[Bridge: Mike Love, Brian Wilson, Carl Wilson]
Maybe if we think and wish and hope and pray, it might come true
Oh, baby, then there wouldn't be a single thing we couldn't do
Oh, we could be married (Oh, we could be married)
And then we'd be happy (And then we'd be happy)
Oh, wouldn't it be nice?
[Chorus: Brian Wilson]
You know it seems the more we talk about it
It only makes it worse to live without it
But let's talk about it
But wouldn't it be nice?

[Outro: Mike Love]
Goodnight, my baby
Sleep tight, my baby
Goodnight, my baby
Sleep tight, my baby
Goodnight, my baby
Sleep tight, my baby23EmbedShare URLCopyEmbedCopy"
49,0KKkJNfGyhkQ5aFogxQAPU,83,That's What I Like,0.853,0.56,0.0406,0.0,134.066,0.9984,0.041,0.233,0.725,"[Verse 1]
Ay, ay, ay
I got a condo in Manhattan
Baby girl, what's happenin'?
You and your ass invited
So go on and get to clappin'
So pop it for a player
Pop, pop it for me
Turn around and drop it for a player
Drop, drop it for me
I'll rent a beach house in Miami (-ami)
Wake up with no jammies (Nope)
Lobster tail for dinner
Julio serve that scampi (Julio!)
You got it if you want it
Got, got it if you want it
Said, you got it if you want it
Take my wallet if you want it now

[Pre-Chorus]
Jump in the Cadillac, girl, let's put some miles on it
Anything you want, just to put a smile on it
You deserve it, baby, you deserve it all
And I'm gonna give it to you

[Chorus]
Gold jewelry shining so bright
Strawberry champagne on ice
Lucky for you, that's what I like, that's what I like
Lucky for you, that's what I like, that's what I like
Sex by the fire at night
Silk sheets and diamonds all white
Lucky for you, that's what I like, that's what I like
Lucky for you, that's what I like, that's what I like
[Verse 2]
I'm talkin' trips to Puerto Rico (Bih)
Say the word, and we go (Say it)
You can be my freaka (Brrrt!)
Girl, I'll be your fleeko
Mamacita
I will never make a promise that I can't keep
I promise that your smile ain't gon' never leave
Shopping sprees in Paris
Everything 24 karats
Take a look in that mirror
Now tell me, who's the fairest?
Is it you? (Is it you?) Is it me? (Is it me?)
Say it's us (Say it's us) and I'll agree, baby

[Pre-Chorus]
Jump in the Cadillac, girl, let's put some miles on it
Anything you want, just to put a smile on it
You deserve it, baby, you deserve it all
And I'm gonna give it to you

[Chorus]
Gold jewellery shining so bright
Strawberry champagne on ice
Lucky for you, that's what I like, that's what I like
Lucky for you, that's what I like, that's what I like
Sex by the fire at night
Silk sheets and diamonds all white
Lucky for you, that's what I like, that's what I like
Lucky for you, that's what I like, that's what I like
[Bridge]
If you say you want a good time
Well, here I am, baby, here I am, baby
Talk to me, talk to me, talk to me
Tell me, what's on your mind? (What's on your mind?)
If you want it, girl, come and get it
All this is here for you
Tell me, baby, tell me, tell me, baby
What you tryna do?

[Chorus]
Gold jewellery shining so bright
Strawberry champagne on ice
Lucky for you, that's what I like, that's what I like
Lucky for you, that's what I like, that's what I like
Sex by the fire at night
Silk sheets and diamonds all white
Lucky for you, that's what I like, that's what I like
Lucky for you, that's what I like, that's what I like93EmbedShare URLCopyEmbedCopy"
50,3B4q6KbHbGV51HO3GznBFF,74,What I Got,0.804,0.696,0.0899,0.000985,95.721,0.9358,0.047,0.102,0.851,"[Intro]
Fuck, you can't even sing

[Verse 1]
Early in the mornin', risin' to the street
Light me up that cigarette and I'll strap shoes on my feet
Got to find the reason, reason things went wrong
Got to find a reason why my money's all gone
I got a dalmatian and I can still get high
I can play the guitar like a motherfuckin' riot

[Verse 2]
Well, life is (too short), so love the one you got
'Cause you might get run over or you might get shot
Never start no static, I just get it off my chest
Never had to battle with no bulletproof vest
Take a small example, take a ti-ti-ti-tip from me
Take all of your money, give it all to charity-ty-ty-ty
Love is what I got, it's within my reach
And the Sublime style's still straight from Long Beach
It all comes back to you, you're bound to get what you deserve
Try and test that, you're bound to get served
Love's what I got, don't start a riot
You'll feel it when the dance gets hot

[Chorus]
Lovin' is what I got
I said, remember that
Lovin' is what I got
And remember that
Lovin' is what I got
I said, remember that
Lovin' is what I got
(I got, I got, I got)
[Verse 3]
Why I don't cry when my dog runs away
I don't get angry at the bills I have to pay
I don't get angry when my mom smokes pot
Hits the bottle and goes right to the rock
Fuckin' and fightin'; it's all the same
Living with Louie Dog's the only way to stay sane
Let the lovin', let the lovin' come back to me

[Chorus]
Lovin' is what I got
I said, remember that
Lovin' is what I got
And remember that
Lovin' is what I got
I said remember that
Lovin' is what I got
(I got, I got, I got)49EmbedShare URLCopyEmbedCopy"
51,3KkXRkHbMCARz0aVfEt68P,84,Sunflower ,0.76,0.479,0.0466,0.0,89.911,-0.4784,0.088,0.063,0.849,"[Intro: Swae Lee]
Ayy, ayy, ayy, ayy (Ooh)
Ooh, ooh, ooh, ooh (Ooh)
Ayy, ayy
Ooh, ooh, ooh, ooh

[Verse 1: Swae Lee]
Needless to say, I keep in check
She was a bad-bad, nevertheless (Yeah)
Callin' it quits now, baby, I'm a wreck (Wreck)
Crash at my place, baby, you're a wreck (Wreck)
Needless to say, I'm keeping in check
She was a bad-bad, nevertheless
Callin' it quits now, baby, I'm a wreck
Crash at my place, baby, you're a wreck
Thinkin' in a bad way, losin' your grip
Screamin' at my face, baby, don't trip
Someone took a big L, don't know how that felt
Lookin' at you sideways, party on tilt
Ooh-ooh, some things you just can't refuse
She wanna ride me like a cruise and I'm not tryna lose

[Chorus: Swae Lee]
Then you're left in the dust, unless I stuck by ya
You're a sunflower, I think your love would be too much
Or you'll be left in the dust, unless I stuck by ya
You're the sunflower, you're the sunflower
[Verse 2: Post Malone]
Every time I'm leavin' on ya (Ooh)
You don't make it easy, no (No, no)
Wish I could be there for ya (Ooh)
Give me a reason to, oh (Oh)
Every time I'm walkin' out (Oh)
I can hear you tellin' me to turn around (Oh, oh)
Fightin' for my trust and you won't back down (No)
Even if we gotta risk it all right now, oh (Now)
I know you're scared of the unknown (Known)
You don't wanna be alone (Alone)
I know I always come and go (And go)
But it's out of my control

[Chorus: Post Malone]
And you'll be left in the dust, unless I stuck by ya
You're the sunflower, I think your love would be too much
Or you'll be left in the dust, unless I stuck by ya
You're the sunflower, you're the sunflower (Yeah)333EmbedShare URLCopyEmbedCopy"
52,59RSrxkSKSixEWBAIvE5Wa,62,Starships,0.747,0.716,0.0751,0.0,125.006,0.7214,0.049,0.082,0.869,"[Intro]
RedOne
Uh

[Verse 1]
Let's go to the beach, each
Let's go get a wave
They say what they gonna say
Have a drink, clink, found the Bud Light
Bad bitches, like me, is hard to come by
The Patrón own, let's go get it on
The zone on, yes, I'm in the zone
Is it two, three? Leave a good tip
I'ma blow off my money and don't give two shits, oh-oh

[Pre-Chorus]
I'm on the floor, floor
I love to dance
So give me more, more
'Til I can't stand
Get on the floor, floor
Like it's your last chance
If you want more, more
Then here I am

[Chorus]
Starships, were meant to fly
Hands up, and touch the sky
Can't stop 'cause we're so high
Let's do this one more time
Starships, were meant to fly
Hands up, and touch the sky
Let's do this one last time
Can't stop...
[Post-Chorus]
We're higher than a motherfucka
We're higher than a motherfucka
We're higher than a motherfucka
[Verse 2]
Jump in my hoopty-hoopty-hoop
I own that
And I ain't payin' my rent this month
I owe that
But fuck who you want, and fuck who you like
Dancehall life, there's no end in sight
Twinkle, twinkle little star
Now everybody let me hear you say ray, ray, ray
Now spend all your money, 'cause today payday
And if you a G, you a G-G-G
My name is Onika, you can call me Nicki

[Pre-Chorus]
Get on the floor, floor
Like it's your last chance
If you want more, more
Then here I am

[Chorus]
Starships, were meant to fly
Hands up, and touch the sky
Can't stop 'cause we're so high
Let's do this one more time
Starships, were meant to fly
Hands up, and touch the sky
Let's do this one last time
Can't stop...
[Post-Chorus]
We're higher than a motherfucka
We're higher than a motherfucka
We're higher than a motherfucka
[Chorus]
Starships, were meant to fly
Hands up, and touch the sky
Can't stop 'cause we're so high
Let's do this one more time
Starships, were meant to fly
Hands up, and touch the sky
Let's do this one last time
Can't stop...

[Post-Chorus]
We're higher than a motherfucka
We're higher than a motherfucka
We're higher than a motherfucka71EmbedShare URLCopyEmbedCopy"
53,6oJ6le65B3SEqPwMRNXWjY,78,Higher Love,0.693,0.678,0.0324,5.71e-06,103.952,0.9996,0.043,0.395,0.562,"[Intro]
Bring me higher love, love
Bring me higher love

[Verse 1]
Think about it, there must be a higher love
Down in the heart or hidden in the stars above
Without it, life is wasted time
Look inside your heart, and I'll look inside mine

[Pre-Chorus]
Things look so bad everywhere
In this whole world, what is fair?
We walk the line and try to see
Falling behind in what could be, oh

[Chorus]
Bring me a higher love
Bring me a higher love, oh
Bring me a higher love
Where's that higher love I keep thinking of?

[Post-Chorus]
Bring me higher love, love
Bring me higher love (Oh)
Bring me higher love, love
Bring me a higher love
Bring me higher love, love
Bring me higher love (Oh)
Bring me higher love, love
Bring me a higher love
[Verse 2]
Worlds are turning, and we're just hanging on
Facing our fear, and standing out there alone
A yearning, yeah, and it's real to me
There must be someone who's feeling for me

[Pre-Chorus]
Things look so bad everywhere
In this whole world, what is fair?
We walk the line and try to see
Falling behind in what could be, oh

[Chorus]
Bring me a higher love (My love)
Bring me a higher love, oh (Oh)
Bring me a higher love (My love)
Where's that higher love I keep thinking of?

[Post-Chorus]
Bring me higher love, love
Bring me higher love (Oh)
Bring me higher love, love
Bring me a higher love

[Chorus]
Bring me a higher love (Oh, bring me love)
Bring me a higher love, oh (We need a higher love)
Bring me a higher love (Bring me, bring me, yeah)
A higher love I keep thinking of, oh
[Post-Chorus]
(Bring me a higher love)
Bring me higher love, love
(Bring me a higher love)
Bring me higher love (Oh)
(Bring me a higher love)
Bring me higher love, love
A higher love I keep thinking of, oh

[Outro]
Bring me a higher love
(Bring me higher love, love)
Bring me a higher love, oh
(Bring me higher love)7EmbedShare URLCopyEmbedCopy"
54,2KKijf6Ett4kmVNJze2roh,72,The Git Up,0.847,0.678,0.109,0.0,97.984,0.9977,0.012,0.138,0.851,"[Intro]
Right now
I just need you to get real loose
Get comfortable
Grab your loved ones or grab your love, partner
And if you're by yourself, no worries
Just follow after me

[Chorus]
Go'n and do the two-step, then cowboy boogie
Grab your sweetheart and spin out with 'em
Do the hoedown and get into it (Woo-hoo-hoo)
Take it to the left now and dip with it
Go'n throw down, take a sip with it
Now lean back, put your hips in it (Woo-hoo-hoo)
Let's have some fun

[Verse 1]
To the left, to the left now (To the left, to the left)
To the right, to the right (To the right)
Now take your left hand and (Uh)
Put it on your side (Put it on your side)
Go'n roll your shoulders (Roll your shoulders)
Do the slip and slide (Do the slip and slide)
This next part's my favorite part, uh
'Cause it's time to shine
[Chorus]
Go'n and do the two-step, then cowboy boogie
Grab your sweetheart and spin out with 'em
Do the hoedown and get into it (Woo-hoo-hoo)
Take it to the left now and dip with it
Go'n throw down, take a sip with it
Now lean back, put your hips in it (Woo-hoo-hoo)
It's simple, you can do it

[Verse 2]
Slide to the left (Left), slide to the right (Right)
Now cool down (Hoo), have a good time (Yeah)
Slide to the left (Left), slide to the right (Right)
Do the butterfly (Oh), have a good time
'Round, 'round, 'round and 'round you go
It's time to show out right now and take to the floor

[Chorus]
Go'n and do the two-step, then cowboy boogie
Grab your sweetheart and spin out with 'em
Do the hoedown and get into it (Woo-hoo-hoo)
Take it to the left now and dip with it
Go'n throw down, take a sip with it
Now lean back, put your hips in it (Woo-hoo-hoo)

[Bridge]
(To the left)
Take it down now, take it, take it down now
Take it down now, take it, take it down now
(To the right)
Bring it up now, bring it, bring it up now
Bring it up now, bring it, bring it up now
(To the front)
Take it down and crisscross
Bring it up, now crisscross
(To the back)
Do whatever you like right here (Get down)
Just have fun
[Chorus]
Go'n and do the two-step, then cowboy boogie
Grab your sweetheart and spin out with 'em
Do the hoedown and get into it (Woo-hoo-hoo)
Take it to the left now and dip with it
Go'n throw down, take a sip with it
Now lean back, put your hips in it (Woo-hoo-hoo), uh

[Interlude]
That was not so bad, that was, that, that was not so bad, was it?
That was not so bad, that, that, that was not so bad, was it?
That was not so bad, that was, that, that was not so bad, was it?
That was not so bad, that, that, that was not so bad, was it?

[Chorus]
Go'n and do the two-step, then cowboy boogie
Grab your sweetheart and spin out with 'em
Do the hoedown and get into it (Woo-hoo-hoo)
Take it to the left now and dip with it
Go'n throw down, take a sip with it
Now lean back, put your hips in it (Woo-hoo-hoo)3EmbedShare URLCopyEmbedCopy"
55,4jPy3l0RUwlUI9T5XHBW2m,89,Mood ,0.701,0.716,0.0361,0.0,91.007,0.998,0.081,0.236,0.683,"[Intro: 24kGoldn]
Oh-oh-oh
Yeah, yeah, yeah, yeah (Yeah)

[Chorus: 24kGoldn]
Why you always in a mood? Fuckin' 'round, actin' brand new
I ain't tryna tell you what to do, but try to play it cool
Baby, I ain't playing by your rules
Everything look better with a view
Why you always in a mood? Fuckin' 'round, actin' brand new
I ain't tryna tell you what to do, but try to play it cool
Baby, I ain't playing by your rules
Everything look better with a view, yeah

[Verse 1: iann dior]
I could never get attached
When I start to feel, I unattach
Somehow I always end up feeling bad
Baby, I am not your dad, it's not all you want from me
I just want your company
Girl, it's obvious, elephant in the room
And we're a part of it, don't act so confused
And you love startin' it, now I'm in a mood
Now we arguin' in my bedroom

[Pre-Chorus: iann dior]
We play games of love to avoid the depression
We been here before and I won't be your victim
[Chorus: 24kGoldn]
Why you always in a mood? Fuckin' 'round, actin' brand new
I ain't tryna tell you what to do, but try to play it cool
Baby, I ain't playing by your rules
Everything look better with a view
Why you always in a mood? Fuckin' 'round, actin' brand new
I ain't tryna tell you what to do, but try to play it cool
Baby, I ain't playing by your rules
Everything look better with a view

[Verse 2: 24kGoldn]
So why you tryin' to fake your love on the regular
When you could be blowin' up just like my cellular?
I won't ever let a shorty go and set me up
Only thing I need to know is if you wet enough
I'm talking slick back, kick back, gang sippin' fourties
You keep playin', not another day with you, shorty
Mismatched fits, that was way before you know me
Got a lot of love, well, you better save it for me

[Pre-Chorus: iann dior, iann dior & 24kGoldn]
We play games of love to avoid the depression
We been here before and I won't be your victim

[Chorus: 24kGoldn]
Why you always in a mood? Fuckin' 'round, actin' brand new
I ain't tryna tell you what to do, but try to play it cool
Baby, I ain't playing by your rules
Everything look better with a view
Why you always in a mood? Fuckin' 'round, actin' brand new
I ain't tryna tell you what to do, but try to play it cool
Baby, I ain't playing by your rules
Everything look better with a view, yeah74EmbedShare URLCopyEmbedCopy"
56,4iJyoBOLtHqaGxP12qzhQI,91,Peaches ,0.677,0.696,0.119,0.0,90.03,0.9938,0.051,0.155,0.795,"[Chorus: Justin Bieber]
I got my peaches out in Georgia (Oh, yeah, shit)
I get my weed from California (That's that shit)
I took my chick up to the North, yeah (Badass bitch)
I get my light right from the source, yeah (Yeah, that’s it)

[Verse 1: Justin Bieber]
And I say, oh (Oh)
The way I breathe you in (In)
It's the texture of your skin
I wanna wrap my arms around you, baby
Never let you go, oh
And I say, oh
There's nothing like your touch
It’s the way you lift me up, yeah
And I'll be right here with you 'til the end of time

[Chorus: Justin Bieber]
I got my peaches out in Georgia (Oh, yeah, shit)
I get my weed from California (That's that shit)
I took my chick up to the North, yeah (Badass bitch)
I get my light right from the source, yeah (Yeah, that's it)

[Verse 2: Daniel Caesar]
You ain't sure yet
But I'm for ya
All I can want, all I can wish for
Nights alone that we miss more
And days we save as souvenirs
There's no time, I wanna make more time
And give you my whole life
I left my girl, I’m in Mallorca
Hate to leave her, call it torture
Remember when I couldn’t hold her
Left her baggage for Rimowa
[Chorus: Justin Bieber]
I got my peaches out in Georgia (Oh, yeah, shit)
I get my weed from California (That's that shit)
I took my chick up to the North, yeah (Badass bitch)
I get my light right from the source, yeah (Yeah, that’s it)

[Verse 3: GIVĒON]
I get the feeling, so I'm sure (Sure)
Hand in my hand because I'm yours, I can't
I can’t pretend, I can't ignore, you're right for me
Don't think you wanna know just where I've been, oh
Done bein' distracted
The one I need is right in my arms (Oh)
Your kisses taste the sweetest with mine
And I'll be right here with you 'til the end of time

[Chorus: Justin Bieber]
I got my peaches out in Georgia (Oh, yeah, shit)
I get my weed from California (That's that shit)
I took my chick up to the North, yeah (Badass bitch)
I get my light right from the source, yeah (Yeah, that's it)
I got my peaches out in Georgia (Oh, yeah, shit)
I get my weed from California (That's that shit)
I took my chick up to the North, yeah (Badass bitch)
(I get my light right from the source, yeah, yeah, that's it)
I got my peaches out in Georgia (Oh, yeah, shit)
I get my weed from California (That's that shit)
I took my chick up to the North, yeah (Badass bitch)
I get my light right from the source, yeah (Yeah, that's it)
I got my peaches out in Georgia (Oh, yeah, shit)
I get my weed from California (That's that shit)
I took my chick up to the North, yeah (Badass bitch)
I get my light right from the source, yeah (Yeah, that's it)57EmbedShare URLCopyEmbedCopy"
57,1dFLowBW25EaL2OC7eKEa2,58,You Look Good,0.656,0.917,0.0495,0.000732,152.067,0.9979,0.01,0.234,0.756,"[Verse 1: Charles Kelley & Hillary Scott]
On a boat, on a beach
In the water, in the sand, in the back of a bar
Cold beer in your hand
Breaking hearts, breaking necks
When we rolling down the street, heads turning all day when they see you with me
I'm thinking everybody better stand in line
'Cause they need to know that your body's coming with me tonight

[Chorus: Charles Kelley & Hillary Scott]
They're like, ""Hey, who that there with the shades?""
Like oh, the way you move to the bass
Hold up
Whole room gets to spinnin' from the second that you walk in
And baby, you look good all day, all night
You look good, so fresh, so fine
You look good, got everybody watching you like cameras in Hollywood
Baby, you look good
Aw, baby, you look good

[Verse 2: Charles Kelley & Hillary Scott]
Black dress to the nines, New Year's in a pent
From the floor, to the roof, make the skyline spin
Yeah, you're killing me boy in your black-faded jeans
Ain't gotta work hard when you're smilin' at me
[Chorus: Charles Kelley & Hillary Scott]
Like, ""Hey, who that there with the shades?""
Like oh, the way you move to the bass
Hold up
Whole room gets to spinnin' from the second that you walk in
And baby, you look good all day, all night
You look good, so fresh, so fine
You look good, got everybody watching you like cameras in Hollywood
Baby, you look good
Aw, baby, you look good

[Bridge: Hillary Scott]
I'm thinking everybody better stand in line
'Cause they need to know that your body's coming with me tonight

[Chorus: Charles Kelley & Hillary Scott]
They're like, ""Hey, who that there with the shades?""
Like oh, the way you move to the bass
Hold up
Whole room gets to spinnin' from the second that you walk in
And baby, you look good all day, all night
You look good, so fresh, so fine
You look good, got everybody watching you like cameras in Hollywood
Baby, you look good
Come on, baby, you look good
You look good
Baby, you look good3EmbedShare URLCopyEmbedCopy"
58,1OppEieGNdItZbE14gLBEv,74,You Can't Hurry Love,0.63,0.711,0.0472,0.0,96.912,0.9991,0.068,0.331,0.601,"[Intro]
I need love, love
To ease my mind
I need to find, find
Someone to call mine
But mama said

[Chorus]
You can't hurry love
No, you just have to wait
She said love don't come easy
It's a game of give and take
You can't hurry love
No, you just have to wait
You got to trust, give it time
No matter how long it takes

[Verse 1]
But how many heartaches must I stand
Before I find a love
To let me live again
Right now the only thing
That keeps me hangin' on
When I feel my strength
Yeah, it's almost gone
I remember mama said
[Chorus]
You can't hurry love
No, you just have to wait
She said love don't come easy
It's a game of give and take
How long must I wait
How much more can I take
Before loneliness
Will cause my heart, heart to break?

[Verse 2]
No I can't bear
To live my life alone
I grow impatient for a love
To call my own
But when I feel that I
I can't go on
These precious words keeps me hangin' on
I remember mama said

[Chorus]
You can't hurry love
No, you just have to wait
She said love don't come easy
It's a game of give and take
You can't hurry love
No, you just have to wait
She said trust, give it time
No matter how long it takes
(Now wait)
[Bridge]
No, love, love
Don't come easy
But I keep on waiting
Anticipating
For that soft voice
To talk to me at night
For some tender arms
To hold me tight
I keep waiting
I keep on waiting (Ooh, until that day)
But it ain't easy
It ain't easy
But mama said

[Chorus]
You can't hurry love
No, you just have to wait
She said trust, give it time
No matter how long it takes
You can't hurry love
No, you just have to wait
She said love don't come easy
It's a game of give and take
(repeat and fade)3EmbedShare URLCopyEmbedCopy"
