,track_uri,popularity,name,danceability,energy,speechiness,instrumentalness,tempo,sentiment,negative,positive,neutral,lyrics
23,0tEPv5fuzMhtm6NM5GvQiF,58,All My Favorite People ,0.422,0.919,0.0639,0.000605,83.867,0.9987,0.032,0.306,0.662,"[Verse 1: Maren Morris]
Not everybody drinks on a Tuesday night
Mixes their liquor with Crystal Light
With a couple of friends they called out of the blue
And not everybody spends what they made that week
On a tank of gas and a little bit of weed
But all my favorite people do

[Chorus: Maren Morris]
I don't know about them, but I know about us
It is what it is and we love who we love
Not everybody gets what we’re going through
But all my favorite people do
Yeah, all my favorite people do

[Post-Chorus: Maren Morris]
Come on, TJ

[Verse 2: TJ Osborne]
Not everybody's gonna find clarity
In a back porch sittin' kind of therapy
With a little bit of wine, John Prine, and Camel Blues (Oh no)
Not everybody leaves well enough alone
Stays out of business that ain’t their own
But all my favorite people do
[Chorus: Maren Morris]
Well, I don't know about them, but I know about us
It is what it is and we love who we love
Not everybody gets what we're going through
But all my favorite people do
Yeah, all my favorite people do

[Bridge: Maren Morris]
All my favorite people, all my favorite people
All my favorite people, yeah, they do
Yeah, we ain't all perfect, but we're doing alright
Everybody's worried 'bout tryin' to get by
But all my favorite people do

[Chorus: Maren Morris]
Well, I don’t know about them, but I know about us
It is what it is and we love who we love
Not everybody gets what we’re going through
But all my favorite people do
Yeah, all my favorite people doEmbedShare URLCopyEmbedCopy"
24,1Pje5DSZWSD1JLEZVx7Fma,0,Jack & Diane,0.818,0.445,0.0503,1.62e-05,103.938,0.9922,0.0,0.17,0.83,"[Verse 1]
Little ditty about Jack and Diane
Two American kids growin' up in the heartland
Jack, he's gonna be a football star
Diane's debutante backseat of Jacky's car

[Verse 2]
Suckin' on a chili dog outside the Tastee Freez
Diane's sittin' on Jacky's lap, he's got his hand between her knees
Jacky say, ""Hey Diane, lets run off behind a shady tree
Dribble off those Bobby Brooks slacks, now do what I please""
Say a....

[Chorus]
Oh yeah, life goes on
Long after the thrill of livin' is gone
I say, oh yeah say life goes on
Long after the thrill of livin' is gone
Now walk on

[Verse 3]
Jacky sits back, collects his thoughts for the moment
Scratches his head and does his best James Dean
""Well then, there Diane, we ought to run off to the city""
Diane says, ""Baby, you ain't missin' nothing""
But Jacky say a...
[Chorus]
Oh yeah, life goes on
Long after the thrill of livin' is gone
Oh yeah I say life goes on
Long after the thrill of livin' is gone

[Bridge]
Gonna let it rock, let it roll
Let the Bible Belt come and save my soul
Holdin on to sixteen as long as you can
Changes come around real soon
Make us women and men

[Chorus]
Oh yeah, life goes on
Long after the thrill of livin' is gone
Oh yeah they say life goes on
Long after the thrill of livin' is gone

[Outro]
A little ditty about Jack and Diane
Two American kids doing the best they can11EmbedShare URLCopyEmbedCopy"
25,3eBnEo9WL34ulBCZlLpUQO,55,Chicken Fried,0.566,0.713,0.0418,0.0,169.861,0.9991,0.017,0.278,0.705,"[Intro]
You know I like my chicken fried
Cold beer on a Friday night
A pair of jeans that fit just right
And the radio up

[Verse 1]
Well I was raised up beneath the shade of a Georgia Pine
And that's home you know
Sweet tea, pecan pie, and homemade wine where the peaches grow
And my house it's not much to talk about
But it's filled with love that's grown in southern ground

[Chorus]
And a little bit of chicken fried
Cold beer on a Friday night
A pair of jeans that fit just right
And the radio up
Well I've seen the sun rise
See the love in my woman's eyes
Feel the touch of a precious child
And know a mother's love

[Verse 2]
It's funny how it's the little things in life that mean the most
Not where you live, what you drive, or the price tag on your clothes
There's no dollar sign on a piece of mind
This I've come to know
So if you agree, have a drink with me
Raise your glasses for a toast
[Chorus]
To a little bit of chicken fried
Cold beer on a Friday night
A pair of jeans that fit just right
And the radio up
Well I've seen the sun rise
See the love in my woman's eyes
Feel the touch of a precious child
And know a mother's love

[Interlude]

[Verse 3]
I thank God for my life
And for the stars and stripes
May freedom forever fly, let it ring
Salute the ones who died
The ones that give their lives so we don't have to sacrifice
All the things we love

[Chorus]
Like our chicken fried
And cold beer on a Friday night
A pair of jeans that fit just right
And the radio up
Well I've seen the sun rise
See the love in my woman's eyes
Feel the touch of a precious child
And know a mother's love
Get your little chicken fried
Cold beer on a Friday night
A pair of jeans that fit just right
And the radio up
Well I've done seen the sun rise
See the love in my woman's eyes
Feel the touch of a precious child
And know a mother's love28EmbedShare URLCopyEmbedCopy"
26,6vxHp3CDNo0afgKGp2yi1E,71,Me and Julio Down by the Schoolyard,0.626,0.816,0.131,1.8e-06,105.307,-0.2363,0.023,0.019,0.959,"[Verse 1]
The Mama pajama rolled outta bed
And she ran to the police station
When the Papa found out, he began to shout
And he started the investigation

[Pre-Chorus]
It's against the law, it was against the law
What the Mama saw, it was against the law

[Verse 2]
The Mama looked down and spit on the ground
Every time my name gets mentioned
The Papa said ""Oy! if I get that boy
I'm gonna stick him in the house of detention""

[Chorus]
Well I'm on my way, I don't know where I'm going
I'm on my way, I'm taking my time, but I don't know where
Goodbye to Rosie, the queen of Corona
Seein' me and Julio down by the schoolyard
Seein' me and Julio down by the schoolyard
[Instrumental break]

[Verse 3]
In a couple of days, they're gonna take me away
But the press let the story leak
When the radical priest come to get me released
We was all on the cover of Newsweek
[Chorus]
Well I'm on my way, I don't know where I'm going
I'm on my way, I'm taking my time, but I don't know where
Goodbye to Rosie, the queen of Corona
Seein' me and Julio down by the schoolyard
Seein' me and Julio down by the schoolyard
Seein' me and Julio down by the schoolyard8EmbedShare URLCopyEmbedCopy"
27,3MWfVTC8ooCmpOveFJbvbT,58,Tequila On A Boat ,0.591,0.877,0.0887,0.0,157.174,0.9835,0.102,0.163,0.735,"[Verse 1: Dustin Lynch]
Blue in the sky, sky on the water
Ninety-eight degrees, it's only getting hotter
With her looking like that, two-piece
On a towel in the back
Song on the speakers, speakers turned up loud
So much sun, we ain't ever gonna run out
Can't nobody hate it, nah
I bought a bottle of my favorite (Yessir!)

[Chorus: Dustin Lynch and Chris Lane]
Tequila on a boat, a boat on a lake
A lake on fire and the tans ain't fake
A girl with a smile, smiling at me
Me with my eyes on her in the heat
Yeah, God's taking care of the weather (Woo)
Life don't get much better
Than ice in a cup, a cup on my lips
Steal another kiss and take another sip
Of tequila on a boat
(Hahahaha, aww yeah, here we go)

[Verse 2: Chris Lane and Dustin Lynch]
Limes in a shaker, shaker full of sea salt
Catching a buzz, but hey it ain't our fault
Blame onto Julio (Julio), hah
Mix it up, baby, here we go (Here we go)
Yeah, time's moving real slow (Yeah)
Drop that anchor down out in the middle (And what?)
And kick back (Hey) and drink a little
[Chorus: Dustin Lynch]
Tequila on a boat, a boat on a lake
A lake on fire and the tans ain't fake
A girl with a smile, smiling at me
Me with my eyes on her in the heat
Yeah, God's taking care of the weather (Woo)
Life don't get much better
Than ice in a cup, a cup on my lips
Steal another kiss and take another sip
Of tequila on a boat

[Bridge: Chris Lane with  Dustin Lynch]
(Uh, hold up)
Yeah, time's moving real slow
Drop that anchor down out in the middle
Everybody, drink a little

[Chorus: Dustin Lynch]
Tequila on a boat, a boat on a lake
A lake on fire and the tans ain't fake
A girl with a smile, smiling at me
Me with my eyes on her in the heat
Hey, God's taking care of the weather (Woo)
Life don't get much better
Than ice in a cup, a cup on my lips
Steal another kiss and take another sip
Of tequila on a boat
[Outro: Dustin Lynch and Chris Lane]
I'll sing it to 'em
Ha, nah, nah, nah, nah
(Nah, nah, nah, nah, nah, nah-nah, nah-nah) That's it
Aww, baby
Tequila on a boatEmbedShare URLCopyEmbedCopy"
28,4cluDES4hQEUhmXj6TXkSo,83,What Makes You Beautiful,0.726,0.787,0.0737,0.0,124.99,-0.99,0.134,0.083,0.783,"[Verse 1: Liam]
You're insecure, don't know what for
You're turning heads when you walk through the door
Don't need makeup to cover up
Being the way that you are is enough

[Pre-Chorus: Harry]
Everyone else in the room can see it
Everyone else but you

[Chorus: All & Harry]
Baby, you light up my world like nobody else
The way that you flip your hair gets me overwhelmed
But when you smile at the ground, it ain't hard to tell
You don't know, oh, oh, you don't know you're beautiful
If only you saw what I can see
You'll understand why I want you so desperately
Right now I'm looking at you and I can't believe
You don't know, you don't know you're beautiful
That's what makes you beautiful

[Verse 2: Zayn]
So c-come on, you got it wrong
To prove I'm right, I put it in a song
I don't know why you're being shy
And turn away when I look into your eyes
[Pre-Chorus: Harry]
Everyone else in the room can see it
Everyone else but you

[Chorus: All, Harry & (Zayn)]
Baby, you light up my world like nobody else (Nobody else)
The way that you flip your hair gets me overwhelmed
But when you smile at the ground, it ain't hard to tell
You don't know, oh, oh, you don't know you're beautiful (Oh)
If only you saw what I can see
You'll understand why I want you so desperately
Right now I'm looking at you and I can't believe
You don't know, you don't know you're beautiful
That's what makes you beautiful

[Bridge: All]
Na na na na na na na na na na na na na na na
Na na na na na na na na na na na na na na

[Breakdown: Harry]
Baby, you light up my world like nobody else
The way that you flip your hair gets me overwhelmed
But when you smile at the ground, it ain't hard to tell
(You don't know, oh-oh,) You don't know you're beautiful

[Chorus: All, Harry & (Zayn)]
Baby, you light up my world like nobody else
The way that you flip your hair (C'mon) gets me overwhelmed
But when you smile at the ground (Ground), it ain't hard to tell
You don't know, oh-oh, you don't know you're beautiful (Beautiful)
If only you saw what I can see
You'll understand why I want you so desperately (Desperately)
Right now I'm looking at you and I can't believe
You don't know, oh-oh, you don't know you're beautiful
Oh-oh-oh, you don't know you're beautiful, oh-oh
That's what makes you beautiful
[Written By Savan Kotecha]75EmbedShare URLCopyEmbedCopy"
29,7qiZfU4dY1lWllzX7mPBI3,87,Shape of You,0.825,0.652,0.0802,0.0,95.977,0.9993,0.022,0.21,0.768,"[Verse 1]
The club isn't the best place to find a lover
So the bar is where I go
Me and my friends at the table doing shots
Drinking fast and then we talk slow
And you come over and start up a conversation with just me
And trust me I'll give it a chance now
Take my hand, stop, put Van the Man on the jukebox
And then we start to dance, and now I'm singing like

[Pre-Chorus]
Girl, you know I want your love
Your love was handmade for somebody like me
Come on now, follow my lead
I may be crazy, don't mind me
Say, boy, let's not talk too much
Grab on my waist and put that body on me
Come on now, follow my lead
Come, come on now, follow my lead

[Chorus]
I'm in love with the shape of you
We push and pull like a magnet do
Although my heart is falling too
I'm in love with your body
And last night you were in my room
And now my bed sheets smell like you
Every day discovering something brand new
I'm in love with your body
Oh—I—oh—I—oh—I—oh—I
I'm in love with your body
Oh—I—oh—I—oh—I—oh—I
I'm in love with your body
Oh—I—oh—I—oh—I—oh—I
I'm in love with your body
Every day discovering something brand new
I'm in love with the shape of you
[Verse 2]
One week in we let the story begin
We're going out on our first date
You and me are thrifty, so go all you can eat
Fill up your bag and I fill up a plate
We talk for hours and hours about the sweet and the sour
And how your family is doing okay
Leave and get in a taxi, then kiss in the backseat
Tell the driver make the radio play, and I'm singing like

[Pre-Chorus]
Girl, you know I want your love
Your love was handmade for somebody like me
Come on now, follow my lead
I may be crazy, don't mind me
Say, boy, let's not talk too much
Grab on my waist and put that body on me
Come on now, follow my lead
Come, come on now, follow my lead

[Chorus]
I'm in love with the shape of you
We push and pull like a magnet do
Although my heart is falling too
I'm in love with your body
And last night you were in my room
And now my bed sheets smell like you
Every day discovering something brand new
I'm in love with your body
Oh—I—oh—I—oh—I—oh—I
I'm in love with your body
Oh—I—oh—I—oh—I—oh—I
I'm in love with your body
Oh—I—oh—I—oh—I—oh—I
I'm in love with your body
Every day discovering something brand new
I'm in love with the shape of you
[Bridge]
Come on, be my baby, come on
Come on, be my baby, come on
Come on, be my baby, come on
Come on, be my baby, come on
Come on, be my baby, come on
Come on, be my baby, come on
Come on, be my baby, come on
Come on, be my baby, come on

[Chorus]
I'm in love with the shape of you
We push and pull like a magnet do
Although my heart is falling too
I'm in love with your body
Last night you were in my room
And now my bed sheets smell like you
Every day discovering something brand new
I'm in love with your body
Come on, be my baby, come on
Come on, be my baby, come on
I'm in love with your body
Come on, be my baby, come on
Come on, be my baby, come on
I'm in love with your body
Come on, be my baby, come on
Come on, be my baby, come on
I'm in love with your body
Every day discovering something brand new
I'm in love with the shape of you403EmbedShare URLCopyEmbedCopy"
30,6jWkZvd1URGktyTTwcpPpB,1,My Girl,0.579,0.419,0.0346,0.0,104.564,0.9547,0.011,0.113,0.876,"[Instrumental Intro]
[Verse 1]
I've got sunshine on a cloudy day
When it's cold outside, I've got the month of May
I guess you'd say
What can make me feel this way?

[Chorus]
My girl, my girl, my girl
Talkin' 'bout my girl, my girl

[Verse 2]
I've got so much honey, the bees envy me
I've got a sweeter song than the birds in the trees
Well, I guess you'd say
What can make me feel this way?

[Chorus]
My girl, my girl, my girl
Talkin' 'bout my girl, my girl

[Bridge]
Ooh, ooh
Hey, hey, hey
Ooh, ooh
Hey, hey, hey
Ooh, ooh, yeah
[Verse 3]
I don't need no money, fortune, or fame
I've got all the riches, baby, one man can claim
Well, I guess you'd say
What can make me feel this way?

[Chorus]
My girl, my girl, my girl
Talkin' 'bout my girl, my girl
(Talkin' 'bout my girl)

[Outro]
I've got sunshine on a cloudy day (Woah, woah)
With my girl
I've even got the month of May
With my girl
Talkin' 'bout my girl31EmbedShare URLCopyEmbedCopy"
31,0yD66650JxhqKbW76C2qCo,70,Country Girl ,0.645,0.904,0.0462,0.0,105.97,0.9918,0.033,0.221,0.746,"Fell in love with a country girl, morning sunshine
She was up from another world, just to bust another soul
Her eyes were an endless flame, holy lightning
Desire with a special name, made to snatch your soul away, yeah

We sailed away on a crimson tide, gone forever
Left my heart on the other side, all to break it into bits
Her smile was a winter song, a Sabbath ending
Don't sleep or you'll find me gone, just an image in the air

In dreams I think of you
I don't know what to do with myself
Time has let me down
She brings broken dreams, fallen stars
The endless search for where you are
(sail on, sail on)

Fell in love with a country girl, morning sunshine
She was up from another world, just to bust another soul
Her eyes were an endless flame, unholy lightning
Desire with a special name, made to snatch your soul away, oh!

Don't sail away on a crimson tide!
Don't leave your heart on the other side!
Her eyes are an endless flame
Desire with a special name
Don't ever fall in love!
Don't give your heart away!
No never, never fall in love with a country girl!1EmbedShare URLCopyEmbedCopy"
32,3X6iIrFuQoCshIWBseEKPl,65,American Woman,0.688,0.671,0.0975,0.0,83.988,-0.8717,0.11,0.053,0.837,"[Intro]
American woman gonna mess your mind
American woman, she gonna mess your mind
Mm, American woman gonna mess your mind
Mm, American woman gonna mess your mind
Say A
Say M
Say E
Say R
Say I
C
Say A
N, mmm
American woman gonna mess your mind
Mm, American woman gonna mess your mind
Uh, American woman gonna mess your mind

Uh!

[Verse 1]
American woman, stay away from me
American woman, mama, let me be
Don't come a-hangin' around my door
I don't wanna see your face no more
I got more important things to do
Than spend my time growin' old with you
Now woman, I said stay away
American woman, listen what I say
[Verse 2]
American woman, get away from me
American woman, mama, let me be
Don't come a-knockin' around my door
Don't wanna see your shadow no more
Coloured lights can hypnotize
Sparkle someone else's eyes
Now woman, I said get away
American woman, listen what I say, hey

[Guitar Solo]

[Verse 3]
American woman, said get away
American woman, listen what I say
Don't come a-hangin' around my door
Don't wanna see your face no more
I don't need your war machines
I don't need your ghetto scenes
Colored lights can hypnotize
Sparkle someone else's eyes
Now woman, get away from me
American woman, mama, let me be

[Outro]
Go, gotta get away, gotta get away
Now go go go
I'm gonna leave you, woman
Gonna leave you, woman
Bye-bye
Bye-bye
Bye-bye
Bye-bye
You're no good for me
I'm no good for you
Gonna look you right in the eye
Tell you what I'm gonna do
You know I'm gonna leave
You know I'm gonna go
You know I'm gonna leave
You know I'm gonna go, woman
I'm gonna leave ya, woman
Goodbye, American woman...4EmbedShare URLCopyEmbedCopy"
33,5tVA6TkbaAH9QMITTQRrNv,78,Free Fallin',0.623,0.449,0.0253,0.0,84.383,0.9991,0.049,0.422,0.528,"[Verse 1]
She's a good girl, loves her mama
Loves Jesus and America too
She's a good girl, crazy 'bout Elvis
Loves horses and her boyfriend too
It's a long day, livin' in Reseda
There's a freeway, runnin' through the yard
And I'm a bad boy, 'cause I don't even miss her
I'm a bad boy for breakin' her heart

[Chorus]
And I'm free, free fallin'
Yeah I'm free, free fallin'

[Verse 2]
All the vampires, walkin' through the valley
Move west down Ventura Boulevard
And all the bad boys are standing in the shadows
And the good girls are home with broken hearts

[Chorus]
And I'm free, I'm free fallin'
Yeah I'm free, free fallin'
(Free fallin', I'm-a free fallin', I'm-a
Free fallin', I'm-a free fallin', I'm-a)
[Verse 3]
I wanna glide down over Mulholland
I wanna write her name in the sky
I'm gonna free fall out into nothin'
Gonna leave this world for a while

[Chorus]
Now I'm free, free fallin'
(Free fallin', I'm-a free fallin', I'm-a
Free fallin', I'm-a free fallin', I'm-a)
Yeah I'm free, free fallin'
(Free fallin', I'm-a free fallin', I'm-a
Free fallin', I'm-a free fallin', I'm-a)

[Outro]
(Free fallin', I'm-a free fallin', I'm-a)
Yeah I'm free, free fallin'
Oh!
(Free fallin', I'm-a free fallin', I'm-a)
Free fallin'
(Free fallin', I'm-a free fallin', I'm-a)
And I'm free, oh, free fallin'
(Free fallin', I'm-a free fallin', I'm-a
Free fallin', I'm-a free fallin', I'm-a)
Free fallin'
(Free fallin', I'm-a free fallin', I'm-a)39EmbedShare URLCopyEmbedCopy"
34,4myBMnNWZlgvVelYeTu55w,0,Brown Eyed Girl,0.478,0.678,0.0364,0.0,151.466,0.8902,0.016,0.054,0.93,"[Verse 1]
Hey, where did we go?
Days when the rains came
Down in the hollow
Playin' a new game
Laughing and a running, hey, hey
Skipping and a jumping
In the misty morning fog with
Our hearts a thumpin' and you
My brown-eyed girl
You, my brown-eyed girl

[Verse 2]
Whatever happened
To Tuesday and so slow?
Going down the old mine
With a transistor radio
Standing in the sunlight laughing
Hiding behind a rainbow's wall
Slipping and sliding
All along the waterfall, with you
My brown-eyed girl
You, my brown-eyed girl

[Chorus]
Do you remember when we used to sing
Sha la la la la la la la la la la te da
Just like that
Sha la la la la la la la la la la te da la te da
[Verse 3]
So hard to find my way
Now that I'm all on my own
I saw you just the other day
My, how you have grown
Cast my memory back there, Lord
Sometimes I'm overcome thinking 'bout
Making love in the green grass
Behind the stadium with you
My brown-eyed girl
You, my brown-eyed girl

[Chorus]
Do you remember when we used to sing
Sha la la la la la la la la la la te da
Sha la la la la la la la la la la te da la te da
Sha la la la la la la la la la la te da la te da18EmbedShare URLCopyEmbedCopy"
35,0GONea6G2XdnHWjNZd6zt3,82,Summer Of '69,0.508,0.834,0.0386,0.0,139.131,0.9909,0.025,0.143,0.832,"[Intro]
I got my first real six string
Bought it at the five and dime
Played it til my fingers bled
Was the summer of '69

[Verse 1]
Me and some guys from school
Had a band and we tried real hard
Jimmy quit and Jody got married
I shoulda known we'd never get far

[Chorus 1]
But when I look back now
That summer seemed to last forever
And if I had the choice
Ya, I'd always wanna be there
Those were the best days of my life

[Verse 2]
Ain't no use in complainin'
When you got a job to do
Spent my evenin's down at the drive-in
And that's when I met you, ya

[Chorus 2]
Standin' on your mama's porch
You told me that you'd wait forever
Oh, and when you held my hand
I knew that it was now or never
Those were the best days of my life
Oh Yeah!
Back in the summer of '69
Oh!
[Bridge]
Man, we were killin' time
We were young and restless
We needed to unwind
I guess nothin' can last forever
Forever, no...

[Interlude]
Yeah!

[Verse 3]
And now the times are changin'
Look at everything that's come and gone
Sometimes when I play that old six string
I think about ya 'n wonder what went wrong

[Chorus 3]
Standin' on your mama's porch
You told me it would last forever
Oh, the way you held my hand
I knew that it was now or never
Those were the best days of my life

[Outro]
Oh yeah
Back in the summer of '69
Uh-huh
It was the summer of '69
Oh yeah
Me and my baby in a 69
Oh! Oh!
It was the summer, summer, summer of 6928EmbedShare URLCopyEmbedCopy"
36,1z6WtY7X4HQJvzxC4UgkSf,76,Love On Top,0.652,0.748,0.0887,0.0,94.1,0.9996,0.036,0.311,0.654,"[Intro]
Bring the beat in

[Verse 1]
Honey, honey
I can see the stars all the way from here
Can't you see the glow on the window pane?
I can feel the sun whenever you're near
Every time you touch me, I just melt away

[Pre-Chorus]
Now everybody asks me why I'm smiling out from ear to ear
(They say love hurts) But I know
(It's gonna take a little work) Oh
Nothing's perfect, but it's worth it
After fighting through my tears
And finally you put me first

[Chorus 1]
Baby, it's you, you're the one I love
You're the one I need, you're the only one I see
Come on, baby, it's you
You're the one that gives your all
You're the one I can always call
When I need you, make everything stop
Finally, you put my love on top
[Post-Chorus]
Ooh, come on, baby!
You put my love on top, top, top, top, top
You put my love on top
Ooh, come on, baby!
You put my love on top, top, top, top, top
You put my love on top

[Verse 2]
Baby, baby, I can feel the wind whipping past my face
As we dance the night away
Boy, your lips taste like a night of champagne
As I kiss you again, and again, and again, and again

[Pre-Chorus]
Now everybody asks me why I'm smiling out from ear to ear
(They say love hurts) But I know
(It's gonna take a little work) Oh
Nothing's perfect, but it's worth it
After fighting through my tears
And finally you put me first

[Chorus 1]
Baby, it's you, you're the one I love
You're the one I need, you're the only one I see
Come on, baby, it's you (It's you)
You're the one that gives your all
You're the one I can always call
When I need you, make everything stop
Finally, you put my love on top
[Post-Chorus]
Ooh, baby!
You put my love on top, top, top, top, top
You put my love on top
Ooh, come on, baby!
You put my love on top, top, top, top, top
You put my love on top

[Chorus 2]
Baby, it's you, you're the one I love
You're the one I need, you're the only thing I see
Come on, baby, it's you (It's you)
You're the one that gives your all
You're the one that always call
When I need you, baby, everything stops
Finally, you put my love on top
Baby, you're the one that I love
Baby, you're all I need
You're the only one I see
Come on, baby, it's you
You're the one that gives your all
You're the one I always call
When I need you, make everything stop
Finally, you put my love on top
Baby, 'cause you're the one that I love
Baby, you're the one that I need
You're the only one I see
Baby, baby, it's you
You're the one that gives your all
You're the one that always calls
When I need you everything stops
Finally you put my love on top
Baby, 'cause you're the one that I love
Baby, you're the one that I need
You're the only one I see
Baby, baby, it's you
You're the one that gives your all
You're the one that always calls
When I need you everything stops
Finally you put my love on top39EmbedShare URLCopyEmbedCopy"
