,track_uri,popularity,name,danceability,energy,speechiness,instrumentalness,tempo,sentiment,negative,positive,neutral,lyrics
30,79a2ejVzj2SpXkpWdfv1Co,7,Sleigh Ride,0.485,0.297,0.0794,0.0,154.639,0.9961,0.077,0.195,0.727,"Just hear those sleigh bells jingling
Ring-ting-tingling too
Come on, it's lovely weather
For a sleigh ride together with you
Outside the snow is falling
And friends are calling, ""Yoo hoo""
Come on, it's lovely weather
For a sleigh ride together with you
Giddy yap, giddy yap, giddy yap
Let's go, let's look at the show
We're riding in a wonderland of snow
Giddy yap, giddy yap, giddy yap
It's grand, just holding your hand
We're riding along with a song
Of a wintry fairy land
Our cheeks are nice and rosy
And comfy cozy are we

We're snuggled up together
Like two birds of a feather would be
Let's take that road before us
And sing a chorus or two
Come on, it's lovely weather
For a sleigh ride together with you
There's a birthday party
At the home of Farmer Gray
It'll be the perfect ending of a perfect day
We'll be singing the songs
We love to sing without a single stop
At the fireplace while we watch
The chestnuts pop; Pop! Pop! Pop!
There's a happy feeling
Nothing in the world can buy
When they pass around the chocolate
And the pumpkin pie
It'll nearly be like a picture print
By Currier and Ives
These wonderful things are the things
We remember all through our lives!
Just hear those sleigh bells jingling
Ring-ting-tingling too
Come on, it's lovely weather
For a sleigh ride together with you
Outside the snow is falling
And friends are calling, ""Yoo hoo""
Come on, it's lovely weather
For a sleigh ride together with you
Giddy yap, giddy yap, giddy yap
Let's go, let's look at the show
We're riding in a wonderland of snow
Giddy yap, giddy yap, giddy yap
It's grand, just holding your hand
We're riding along with a song
Of a wintry fairy land
Our cheeks are nice and rosy
And comfy cozy are we
We're snuggled up together
Like two birds of a feather would be
Let's take that road before us
And sing a chorus or two
Come on, it's lovely weather
For a sleigh ride together with you
Giddy yap, giddy yap, giddy yap
Giddy yap, giddy yap, giddy yap
Whoa!1EmbedShare URLCopyEmbedCopy"
31,10HDoLPz2bucGBkoNEjDHW,1,Step Into Christmas,0.54,0.928,0.0337,1.11e-05,140.419,0.9976,0.005,0.219,0.776,"[Verse 1]
Welcome to my Christmas song
I'd like to thank you for the year
So I'm sendin' you this Christmas card
To say, ""It's nice to have you here""

[Pre-Chorus]
I'd like to sing about all the things
Your eyes and mind can see
So hop aboard the turntable
Oh, step into Christmas with me, yeah

[Chorus]
Step into Christmas, let's join together
We can watch the snow fall forever and ever
Eat, drink and be merry, come along with me
Step into Christmas, the admission's free

[Verse 2]
Take care in all you do next year
And keep smilin' through the days
If we can help to entertain you
Oh, we will find the ways

[Pre-Chorus]
So merry Christmas, one and all
There's no place I'd rather be
Than askin' you if you'd oblige
Steppin' into Christmas with me
[Chorus]
Step into Christmas, let's join together
We can watch the snow fall forever and ever
Eat, drink and be merry, come along with me
Step into Christmas, the admission's free, oh

[Verse 1]
Welcome to my Christmas song
I'd like to thank you for the year
So I'm sendin' you this Christmas card
To say, ""It's nice to have you here""

[Pre-Chorus]
I'd like to sing about all the things
Your eyes and mind can see
So hop aboard the turntable
Oh, step into Christmas with me, yeah

[Chorus]
Step into Christmas, let's join together
We can watch the snow fall forever and ever
Eat, drink and be merry, come along with me
Step into Christmas, the admission's free

[Chorus]
Step into Christmas, let's join together
We can watch the snow fall forever and ever
Eat, drink and be merry, come along with me
Step into Christmas, the admission's free
[Chorus]
Step into Christmas, let's join together
We can watch the snow fall forever and ever
Eat, drink and be merry, come along with me
Step into Christmas, the admission's free, oh

[Outro]
(Step, step into Christmas)
(Ah, forever and ever)
(Yeah, come along with me)
(Ah) Oh
(Step, step into Christmas)
(Ah, forever and ever)
(Yeah, come along with me)
(Ah)EmbedShare URLCopyEmbedCopy"
32,5Q2P43CJra0uRAogjHyJDK,77,"Baby, It's Cold Outside ",0.583,0.572,0.0366,0.0,113.998,0.9537,0.059,0.105,0.836,"[Verse 1: Marilyn Maxwell & Dean Martin]
I really can't stay (But, baby, it's cold outside)
I've got to go away (But, baby, it's cold outside)
This evening has been (Been hoping that you'd drop in)
So very nice (I'll hold your hands, they're just like ice)
My mother will start to worry (Beautiful, what's your hurry?)
My father will be pacing the floor (Listen to the fireplace roar)
So, really, I'd better scurry (Beautiful, please don't hurry)
But maybe just a half a drink more (Put some records on while I pour)
The neighbors might think (Baby, it's bad out there)
Say, what's in this drink? (No cab's to be had out there)
I wish I knew how (Your eyes are like starlight now)
To break this spell (I'll take your hat, your hair looks swell)
I ought to say, ""No, no, no, sir"" (Mind if I move in closer?)
At least I'm gonna say that I tried (What's the sense of hurtin' my pride?)

[Chorus: Marilyn Maxwell, Dean Martin & Both]
I really can't stay
(Oh, baby, don't hold out)
Baby, it's cold outside

[Verse 2: Marilyn Maxwell & Dean Martin]
I simply must go (But, baby, it's cold outside)
The answer is no (But, baby, it's cold outside)
Your welcome has been (How lucky that you dropped in)
So nice and warm (Look out the window at the storm)
My sister will be suspicious (Gosh your lips look delicious)
My brother will be there at the door (Waves upon the tropical shore)
My maiden aunt's mind is vicious (Gosh your lips are delicious)
But maybe just a cigarette more (Never such a blizzard before)
I've gotta get home (But, baby, you'd freeze out there)
Say, lend me a coat (It's up to your knees out there)
You've really been grand (I thrill when you touch my hand)
But don't you see? (How can you do this thing to me?)
There's bound to be talk tomorrow (Think of my lifelong sorrow)
At least there will be plenty implied (If you got pneumonia and died)
[Chorus: Marilyn Maxwell, Dean Martin & Both]
I really can't stay
(Get over that cold out)
Baby, it's cold
Baby, it's cold outside5EmbedShare URLCopyEmbedCopy"
33,0YWUHZPJVg4iujddsJDwhM,79,My Only Wish ,0.669,0.843,0.0268,0.0,147.08,0.999,0.0,0.321,0.679,"[Verse 1]
If only given one wish for Christmas
A lot of things would truly come to mind
I’d think of everything from snow to trees and mistletoe
But only this one wish would touch my heart

[Chorus]
My only wish for Christmas is you
You're the only gift I wanted, but had to choose
Above all presents big and small, you're the greatest gift of all
My only wish for Christmas is you

[Verse 2]
I don’t need all those fancy decorations
I’d do without my mother’s pumpkin pie
I’d give up all the Christmas cards just to have you in my arms
That's why my only wish this year is you

[Chorus]
My only wish for Christmas is you
You're the only gift I wanted, but had to choose
Above all presents big and small, you're the greatest gift of all
My only wish for Christmas is you

[Bridge]
Your love means more than colored lights, more than snowy winter nights
A present any shape or size can’t match the beauty of your eyes
Of all the things I could receive, you’re the only gift I need
My only wish for Christmas is you
Yeah, yeah, yeah, yeah
[Chorus]
My only wish for Christmas is you
You're the only gift I wanted, but had to choose
Above all presents big and small, you're the greatest gift of all
My only wish for Christmas is you

[Outro]
My only wish for Christmas is you
My only wish for Christmas is you
Only wish for Christmas
Only wish for Christmas
Is you (Is you), is you (Is you)
Is you (Is you), is you (Is you)
My only wish for Christmas is you
Is you (Is you), is you (Is you)
La-de-da-da
La-de-da-daEmbedShare URLCopyEmbedCopy"
34,0tXPhc8LvM4dPvoRwI66XQ,69,I'll Be Home for Christmas,0.282,0.101,0.0315,5.05e-05,83.13,0.9747,0.0,0.221,0.779,"I'm dreaming tonight of a place I love
Even more than I usually do
And although I know it's a long road back
I promise you

I'll be home for Christmas
You can count on me
Please have snow and mistletoe
And presents on the tree

Christmas Eve will find me
Where the love light gleams
I'll be home for Christmas
If only in my dreams

Please have snow and mistletoe
And presents on the tree

Christmas Eve will find me
Where the love light gleams
I'll be home for Christmas
If only in my dreams
If only in my dreamsEmbedShare URLCopyEmbedCopy"
35,1OjmlSFuzYflWjSMTCyTJv,79,Like It's Christmas,0.725,0.571,0.102,0.0,146.035,0.9976,0.041,0.222,0.736,"[Intro]
Dum-dum-dum-dum

[Verse 1: Nick Jonas]
There's snow on the ground, love in the air, sleigh bells are ringin'
This is what it's all about, the fire is warm, the angels are singin'

[Pre-Chorus: Nick Jonas with Joe Jonas]
And I don't wanna miss a single thing
Don't wanna put an end to all this cheer
But as long as you're with me
It's always that time of the year

[Chorus: Joe Jonas with Nick Jonas]
You make everyday feel like it's Christmas, never wanna stop
Feelin' like the first thing on your wishlist, right up at the top
I can't deny what I'm feelin' inside
Nothin' fake about the way you bring me to life
You make everyday feel like it's Christmas
Everyday that I'm with you

[Verse 2: Joe Jonas with Nick Jonas]
Look at the lights, twinklin' bright twenty-four/seven
Every inch of Central Park is covered in white, this could be heaven

[Pre-Chorus: Joe Jonas with Nick Jonas]
And I don't wanna miss a single thing
Don't wanna put an end to all this cheer
But as long as you're with me
It's always that time of the year, yeah (Woo)
[Chorus: Joe Jonas with Nick Jonas, Nick Jonas]
You make everyday feel like it's Christmas (Like it's Christmas), never wanna stop
Feelin' like the first thing on your wishlist, right up at the top
I can't deny what I'm feelin' inside
Nothin' fake about the way you bring me to life
You make everyday feel like it's Christmas
Everyday that I'm with you

[Bridge: Joe Jonas & Nick Jonas]
Woo, woo, woo, yeah (Everyday that I'm with you)
Everyday, every night (Oh, oh, all day)

[Chorus: Joe Jonas with Nick Jonas]
You make everyday feel like it's Christmas, never wanna stop
Feelin' like the first thing on your wishlist, right up at the top (And I can't deny)
I can't deny what I'm feelin' inside
Nothin' fake about the way you bring me to life
You make everyday feel like it's Christmas
Everyday that I'm with you

[Outro: Joe Jonas & Nick Jonas]
Hey, hey, yeah, everyday, la-la-la
I can't deny what I'm feelin' inside
No matter the reason, no matter the season
My heart'll keep beatin', you better believe
You make everyday feel like it's Christmas (Like it's Christmas)
Everyday that I'm with you (Oh-oh-oh, oh-oh-oh, oh-oh-oh)
Everyday that I'm with you (Oh-oh-oh, oh-oh-oh, oh-oh-oh)
Everyday that I'm with you1EmbedShare URLCopyEmbedCopy"
36,4ricyQVd20UQde1jpXCSuJ,17,Winter Wonderland,0.452,0.366,0.0415,0.0,114.993,0.0926,0.077,0.07,0.853,"Sleigh bells ring, are you listening
In the lane, snow is glistening
A beautiful sight
We're happy tonight
Walking in a winter wonderland

Gone away is the bluebird
Here to stay is a new bird
He sings a love song
As we stroll along
Walking in a winter wonderland

In the meadow we can build a snowman
We'll pretend that he is Parson Brown
He'll say ""Are you married?""
We'll say ""No man""
But you can do the job
When you're in town

Later on, we'll conspire
As we dream by the fire
To face unafraid
The plans that we've made
Walking in a winter wonderland

In the meadow we can build a snowman
We'll pretend that he is Parson Brown
He'll say ""Are you ready?""
We'll say ""No man""
But you can do the job
When you're in town
Later on, we'll conspire
As we dream by the fire
To face unafraid
The plans that we've made
Walking in a winter wonderland
Walking in a winter wonderland
Walking in a winter wonderlandEmbedShare URLCopyEmbedCopy"
37,15sxLiiChE5dCW3Y756oas,78,I Saw Mommy Kissing Santa Claus,0.583,0.712,0.0538,1.02e-06,128.897,0.9969,0.0,0.263,0.737,"[Spoken Intro]
Merry Christmas and a happy new year
This is Michael Jackson and The Jackson 5 wishing a happy holiday to all mountain fans

[Intro]
Wow! Mommy's kissing Santa Claus!

[Verse 1]
I saw mommy kissing Santa Claus (kissing, kissing, Santa Claus)
Underneath the mistletoe last night
She didn't see me creep
Down the stairs to have a peep
She thought that I was tucked up
In my bedroom, fast asleep

[Chorus]
Then I saw mommy tickle, tickle (tickle, tickle, Santa Claus)
Underneath his beard so snowy white
Oh, what a laugh it would have been
If Daddy had only seen
Mommy kissing Santa Claus last night

[Bridge]
He saw mommy kissing (kissing, kissing, Santa Claus)
I did! I really did see mommy kissing Santa Claus
And I'm gonna tell my dad
[Verse 2]
Then I saw mommy tickle (tickle, tickle, Santa Claus)
Underneath his beard so snowy white
Oh, what a laugh it would have been
If Daddy had only seen
Mommy kissing Santa Claus last night
Oh, what a laugh it would have been
If Daddy had only seen
Mommy kissing Santa Claus last night

[Bridge]
I did! I did! I really did see mommy kissing Santa Claus
You gotta believe me! You just gotta believe me!
Come on, fellas, believe me!
You just gotta believe me! (I told you, I told you)3EmbedShare URLCopyEmbedCopy"
38,6YJdPrH3i2POzu7hdHIRrb,78,Santa Baby,0.748,0.778,0.137,0.0,95.989,0.863,0.033,0.081,0.885,"[Verse 1]
Santa baby, just slip a sable under the tree
For me
Been an awful good girl
Santa baby, so hurry down the chimney tonight

[Verse 2]
Santa baby, a 54 convertible too
Light blue
I'll wait up for you dear
Santa baby, so hurry down the chimney tonight

[Chorus]
Think of all the fun I've missed
Think of all the fellas that I haven't kissed
Next year I could be just as good
If you'll check off my Christmas list

[Verse 3]
Santa baby, I want a yacht
And really that's not a lot
Been an angel all year
Santa baby, so hurry down the chimney tonight

[Verse 4]
Santa honey, one little thing I really need
The deed
To a platinum mine
Santa baby, so hurry down the chimney tonight
[Verse 5]
Santa cutie, and fill my stocking with a duplex
And checks
Sign your 'X' on the line
Santa cutie, and hurry down the chimney tonight

[Bridge]
Come and trim my Christmas tree
With some decorations bought at Tiffany's
I really do believe in you
Let's see if you believe in me

[Outro]
Santa baby, forgot to mention one little thing
A ring
I don't mean on the phone
Santa baby, so hurry down the chimney tonight
Hurry down the chimney tonight
Hurry, tonight4EmbedShare URLCopyEmbedCopy"
39,78pn8k7RogKo2oxl0DyX6d,77,One More Sleep,0.638,0.813,0.0362,0.0,112.986,0.9396,0.048,0.077,0.875,"[Verse 1]
Snow is falling all around us
My baby's coming home for Christmas
I've been up all night inside my bedroom
He said he'll be with me real soon
So I wait
And I wait
But I've had as much as I can take

[Chorus]
'Cause I've got five more nights of sleeping on my own
Four more days until you're coming home
Three more dreams of you and mistletoe
Two more reasons why I love you so
I've got five more nights until you're next to me
Four more days of being lonely
Three more wishes, I can barely breathe
If I can make it to Christmas Eve then it's
One more sleep (one more sleep until it's Christmas)
One more sleep (Can't believe how much I missed us)
One more sleep (One more sleep until it's Christmas)
One more sleep

[Verse 2]
Now I don't think I can remember
A cold and lonelier December
And I find myself singing at the window
Wondering when you're gonna get back home
So I try
And I try
But there is nothing I can do to pass this time
[Chorus]
'Cause I've got five more nights of sleeping on my own
Four more days until you're coming home
Three more dreams of you and mistletoe
Two more reasons why I love you so
I've got five more nights until you're next to me
Four more days of being lonely
Three more wishes, I can barely breathe
If I can make it to Christmas Eve then it's
One more sleep (one more sleep until it's Christmas)
One more sleep (Can't believe how much I missed us)
One more sleep (One more sleep until it's Christmas)
One more sleep

[Bridge]
Until we're rocking around the Christmas tree
Until I got you sitting next to me
We got a lot of catching up to do
I just can't take this missing you

[Chorus 2]
Five more nights on my own
Four more days, hmm
Three more dreams, mistletoe
I can't believe I ever let you go, oh
Five more nights of sleeping on my own (Yeah) (On my own)
Four more days until you're coming home (Until you're coming home)
Three more wishes, I can barely breathe
If I can make it to Christmas Eve then it's
One more sleep
One more sleep
One more sleep
One more sleep1EmbedShare URLCopyEmbedCopy"
40,35ys6iS1supcwFoxLJkFbg,0,Santa Claus Is Comin' to Town ,0.355,0.668,0.0482,1.23e-06,139.734,0.9919,0.038,0.293,0.67,"[Chorus]
You better watch out, you better not cry
You better not pout, I'm telling you why
Santa Claus is comin' to town

[Bridge]
He's making a list and checking it twice
Gonna find out who's naughty and nice
Santa Claus is comin' to town

[Verse 1]
He sees you when you're sleeping
He knows when you're awake
He knows if you've been bad or good
So be good for goodness sake

[Chorus]
You better watch out, you better not cry
You better not pout, I'm telling you why
Santa Claus is comin' to town

[Verse 1]
He sees you when you're sleeping
He knows when you're awake
He knows if you've been bad or good
So be good for goodness sake
[Chorus]
You better watch out, you better not cry
You better not pout, I'm telling you why
Santa Claus is comin' to townEmbedShare URLCopyEmbedCopy"
