,track_uri,popularity,name,danceability,energy,speechiness,instrumentalness,tempo,sentiment,negative,positive,neutral,lyrics
48,6yaxdh87KVj82QIYKTP1zt,1,It's Beginning To Look A Lot Like Christmas,0.423,0.301,0.0391,0.00263,136.791,0.9927,0.0,0.193,0.807,"[Verse 1]
It's beginning to look a lot like Christmas
Everywhere you go;
Take a look at the five and ten
It's glistening once again
With candy canes and silver lanes aglow
It's beginning to look a lot like Christmas
Toys in every store
But the prettiest sight to see is the holly that will be
On your own front door

[Verse 2]
A pair of hop-a-long boots and a pistol that shoots
Is the wish of Barney and Ben;
Dolls that will talk and will go for a walk
Is the hope of Janice and Jen;
And Mom and Dad can hardly wait for school to start again
It's beginning to look a lot like Christmas
Everywhere you go;
There's a tree in the Grand Hotel, one in the park as well
It's the sturdy kind that doesn't mind the snow

[Verse 3]
It's beginning to look a lot like Christmas;
Soon the bells will start
And the thing that will make them ring is the carol that you sing
Right within your heart
It's beginning to look a lot like Christmas
Toys in every store
But the prettiest sight to see is the holly that will be
On your own front door
[Outro]
Sure it's Christmas once more5EmbedShare URLCopyEmbedCopy"
49,5DHfUmmnlFJPqa9MnKe0EX,40,Christmas ,0.341,0.761,0.0507,0.000416,126.312,0.9979,0.0,0.173,0.827,"[Verse 1]
On the first day of Christmas, my true love sent to me
A partridge in a pear tree

[Verse 2]
On the second day of Christmas, my true love sent to me
Two turtle doves, and
A partridge in a pear tree

[Verse 3]
On the third day of Christmas, my true love sent to me
Three french hens
Two turtle doves, and
A partridge in a pear tree

[Verse 4]
On the fourth day of Christmas, my true love sent to me
Four calling birds
Three french hens
Two turtle doves, and
A partridge in a pear tree

[Verse 5]
On the fifth day of Christmas, my true love sent to me
Five golden rings
Four calling birds
Three french hens
Two turtle doves, and
A partridge in a pear tree
[Verse 6]
On the sixth day of Christmas, my true love sent to me
Six geese a-laying
Five golden rings
Four calling birds
Three french hens
Two turtle doves, and
A partridge in a pear tree

[Verse 7]
On the seventh day of Christmas, my true love sent to me
Seven swans a-swimming
Six geese a-laying
Five golden rings
Four calling birds
Three french hens
Two turtle doves, and
A partridge in a pear tree

[Verse 8]
On the eighth day of Christmas, my true love sent to me
Eight maids a-milking
Seven swans a-swimming
Six geese a-laying
Five golden rings
Four calling birds
Three french hens
Two turtle doves, and
A partridge in a pear tree
[Verse 9]
On the ninth day of Christmas, my true love sent to me
Nine ladies dancing
Eight maids a-milking
Seven swans a-swimming
Six geese a-laying
Five golden rings
Four calling birds
Three french hens
Two turtle doves, and
A partridge in a pear tree

[Verse 10]
On the tenth day of Christmas, my true love sent to me
Ten lords a-leaping
Nine ladies dancing
Eight maids a-milking
Seven swans a-swimming
Six geese a-laying
Five golden rings
Four calling birds
Three french hens
Two turtle doves, and
A partridge in a pear tree

[Verse 11]
On the eleventh day of Christmas, my true love sent to me
Eleven pipers piping
Ten lords a-leaping
Nine ladies dancing
Eight maids a-milking
Seven swans a-swimming
Six geese a-laying
Five golden rings
Four calling birds
Three french hens
Two turtle doves, and
A partridge in a pear tree
[Verse 12]
On the twelfth day of Christmas, my true love sent to me
Twelve drummers drumming
Eleven pipers piping
Ten lords a-leaping
Nine ladies dancing
Eight maids a-milking
Seven swans a-swimming
Six geese a-laying
Five golden rings
Four calling birds
Three french hens
Two turtle doves, and
A partridge in a pear tree23EmbedShare URLCopyEmbedCopy"
50,5jjsm4Jjq8xjDaue3rW9Go,0,Joy To The World,0.581,0.312,0.0329,0.0,102.107,0.9879,0.092,0.26,0.647,"[Verse 1]
Joy to the world, the Lord has come
Let earth receive her King
Let every heart prepare Him room
And heaven and nature sing, and heaven and nature sing
And heaven, and heaven and nature sing

[Verse 2]
Joy to the world, the Savior reigns
Let men their songs employ
While fields and floods, rocks, hills, and plains
Repeat the sounding joy, repeat the sounding joy
Repeat, repeat the sounding joy

[Verse 3]
No more let sins and sorrows grow
Nor thorns infest the ground
He comes to make His blessings flow
Far as the curse is found, far as the curse is found
Far as, far as the curse is found

[Verse 4]
He rules the world with truth and grace
And makes the nations prove
The glories of His righteousness
And wonders of His love, and wonders of His love
And wonders, wonders of His loveEmbedShare URLCopyEmbedCopy"
51,0QtJZpyfZF67QF32p41NXa,71,Thank God It's Christmas,0.573,0.475,0.0258,0.0,107.759,0.9992,0.043,0.5,0.457,"[Verse 1]
Oh, my love, we've had our share of tears
Oh, my friend, we've had our hopes and fears
Oh, my friends, it's been a long hard year

[Pre-Chorus]
But now it's Christmas
Yes, it's Christmas
Thank God it's Christmas

[Verse 2]
The moon and stars seem awful cold and bright
Let's hope the snow will make this Christmas right
My friend, the world will share this special night

[Pre-Chorus]
Because it's Christmas
Yes, it's Christmas
Thank God it's Christmas
For one night

[Chorus]
Thank God it's Christmas, yeah
Thank God it's Christmas
Thank God it's Christmas
Can it be Christmas?
Let it be Christmas
Every day
[Verse 3]
Oh, my love, we live in troubled days
Oh, my friend, we have the strangest ways
All my friends on this one day of days
Thank God it's Christmas
Yes it's Christmas
Thank God it's Christmas
For one day

[Outro]
Thank God it's Christmas
Yes, it's Christmas
Thank God it's Christmas
Ooh yeah
Thank God it's Christmas
Yes, yes, yes, yes, it's Christmas
Thank God it's Christmas
For one day
A very merry Christmas to you all2EmbedShare URLCopyEmbedCopy"
52,6MPpnJDLk37GEIM0iGGITd,1,Frosty The Snowman,0.57,0.51,0.057,0.0,76.919,0.9832,0.0,0.111,0.889,"[Verse 1]
Frosty the snowman was a jolly happy soul
With a corncob pipe and a button nose
And two eyes made out of coal
Frosty the snowman is a fairy tale, they say
He was made of snow but the children know
How he came to life one day
There must have been some magic in
That old silk hat they found
For when they placed it on his head
He began to dance around
Oh, Frosty the snowman
Was alive as he could be
And the children say he could laugh and play
Just the same as you and me

[Chorus]
Thumpety thump thump
Thumpety thump thump
Look at Frosty go
Thumpety thump thump
Thumpety thump thump
Over the hills of snow

[Verse 2]
Ooh Frosty the snowman
Knew the sun was hot that day
So he said, ""Let's run and we'll have some fun
Now before I melt away.""
Down to the village
With a broomstick in his hand
Running here and there all around the square
Saying ""catch me if you can!""
He led them down the streets of town
Right to the traffic cop
And he only paused a moment when
He heard him holler ""Stop!""
Oh, Frosty the snowman
Had to hurry on his way
But he waved goodbye, saying
""Don't you cry, I'll be back again someday.""
[Chorus]
Thumpety thump thump
Thumpety thump thump
Look at Frosty go
Thumpety thump thump
Thumpety thump thump
Over the hills of snow!2EmbedShare URLCopyEmbedCopy"
53,4KV9bM7a1KDc7b7OakFZic,74,Jingle Bells,0.706,0.383,0.0342,0.0,86.997,0.9864,0.004,0.107,0.889,"[Verse 1]
Dashing through the snow
In a one-horse open sleigh
O'er the fields we go
Laughing all the way
Bells on bobtails ring
Making spirits bright
What fun it is to ride and sing
A sleighing song tonight

[Chorus]
Jingle bells, jingle bells
Jingle all the way
Oh, what fun it is to ride
In a one-horse open sleigh, hey
Jingle bells, jingle bells
Jingle all the way
Oh, what fun it is to ride
In a one-horse open sleigh

[Verse 2]
A day or two ago
I thought I'd take a ride
And soon, Miss Fanny Bright
Was seated by my side
The horse was lean and lank
Misfortune seemed his lot
He got into a drifted bank
And then we got upsot
[Chorus]
Jingle bells, jingle bells
Jingle all the way
Oh, what fun it is to ride
In a one-horse open sleigh, hey
Jingle bells, jingle bells
Jingle all the way
Oh, what fun it is to ride
In a one-horse open sleigh

[Verse 3]
A day or two ago
The story I must tell
I went out on the snow
And on my back I fell
A gent was riding by
In a one-horse open sleigh
He laughed as there I sprawling lie
But quickly drove away

[Chorus]
Jingle bells, jingle bells
Jingle all the way
Oh, what fun it is to ride
In a one-horse open sleigh, hey
Jingle bells, jingle bells
Jingle all the way
Oh, what fun it is to ride
In a one-horse open sleigh
[Verse 4]
Now the ground is white
Go it while you're young
Take the girls tonight
And sing this sleighing song
Just get a bobtailed bay
Two forty as his speed
Hitch him to an open sleigh
And crack, you'll take the lead

[Chorus]
Jingle bells, jingle bells
Jingle all the way
Oh, what fun it is to ride
In a one-horse open sleigh, hey
Jingle bells, jingle bells
Jingle all the way
Oh, what fun it is to ride
In a one-horse open sleigh25EmbedShare URLCopyEmbedCopy"
54,5MknXpAUgINT11lxoobaJK,72,Bring Me Love,0.505,0.86,0.425,0.0,191.535,0.9991,0.029,0.284,0.687,"[Verse 1]
I don't need my stocking filled with toys
And I don't need no gifts to bring me joy
Baby, I-I haven't hung my mistletoe
'Cause without you, baby, I can't see no point

[Chorus]
Baby I hope Santa brings you to me
'Cause it's all I wished for this Christmas Eve
No, I don't want much, your love is all I need
Baby, I hope Santa brings you to me

[Refrain]
Hope he's bringing me love this Christmas (Love this Christmas)
'Cause I deserve you here (Deserve you here)
Bring me love this Christmas (Love this Christmas)
'Cause I've been good this year
Hope he's bringing me love this Christmas (Love this Christmas)
'Cause I deserve you here (Deserve you here)
Bring me love this Christmas (Love this Christmas)
'Cause I've been good this year

[Verse 2]
I don't wanna light this tree alone (No, no, I can't)
I can't sing Christmas songs if you're not home
No, I-I haven't hung my mistletoe
'Cause without you, baby, I can't see no point
[Chorus]
Baby, I hope Santa brings you to me
'Cause it's all I wished for this Christmas Eve
No, I don't want much, your love is all I need
Baby, I hope Santa brings you to me

[Refrain]
Hope he's bringing me love this Christmas (Love this Christmas)
'Cause I deserve you here (Deserve you here)
Bring me love this Christmas (Love this Christmas)
'Cause I've been good this year

[Verse 3]
It's been so cold since you've been gone (Been gone)
This winter seems so long (So long)
And I can't get in no spirit
It feels so wrong

[Bridge]
Bring me love this Christmas
'Cause I deserve you here
Bring me love this Christmas
'Cause I've been good this year

[Refrain]
Hope he's bringing me love (Love this Christmas)
'Cause I deserve you here (Deserve you here)
Bring me love this Christmas (Love this Christmas)
'Cause I've been good this year
Hope he's bringing me love (Love this Christmas)
'Cause I deserve you here (Deserve you here)
Bring me love this Christmas (Love this Christmas)
'Cause I've been good this year
Hope he's bringing me love (Love this Christmas)
'Cause I deserve you here (Deserve you here)
Bring me love love this Christmas (Love this Christmas)
'Cause I've been good this year
[Outro]
Hey (Love this Christmas)
Would you bring me love (Deserve you here)
(Love this Christmas) yeah, yeah
(Good this year)
(Love this Christmas) It's the only thing I need baby (Deserve you here)
(Love this Christmas) yeah
Ho, ho, ho, ah
YeahhhEmbedShare URLCopyEmbedCopy"
55,30WHma5z5Sty54jbtoxYEy,0,Run Rudolph Run,0.679,0.622,0.0961,1.34e-05,152.027,0.9268,0.02,0.113,0.867,"Out of all the reindeers, you know you're the mastermind
Run, run Rudolph, Randalph ain't too far behind
Run, run Rudolph, Santa's got to make it to town
Santa make him hurry, tell him he can take the freeway down
Run, run Rudolph cause I'm reeling like a merry-go-round

Said Santa to a boy ""Child, what have you been longing for?""
""All I want for Christmas is a Rock and Roll electric guitar""
And then away went Rudolph whizzing like a shooting star

Run, run Rudolph, Santa has to make it to town
Santa make him hurry, tell him he can take the freeway down
Run, run Rudolph, reeling like a merry-go-round

Run, run Rudolph, Santa's got to make it to town
Santa make him hurry, tell him he can take the freeway down
Run, run Rudolph, I'm reeling like a merry-go-round

Said Santa to a girl ""Child, what would please you most to get?""
""A little baby doll that can cry, sleep, drink and wet""
And then away went Rudolph, whizzing like a Saber jet

Run, run Rudolph, Santa's got to make it to town
Santa make him hurry, tell him he can take the freeway down
Run, run Rudolph, I'm reeling like a merry-go-roundEmbedShare URLCopyEmbedCopy"
56,7n7VsX3sv66znBwA8b5uhp,77,Here Comes Santa Claus ,0.575,0.236,0.0422,0.0178,79.576,0.9822,0.02,0.121,0.859,"[Verse 1]
Here comes Santa Claus, here comes Santa Claus, right down Santa Claus Lane
Vixen and Blitzen and all his reindeers pulling on the reins
Bells are ringing, children singing, all is merry and bright
So hang your stockings and say your prayers, 'cause Santa Claus comes tonight

[Verse 2]
Here comes Santa Claus, here comes Santa Claus, right down Santa Claus Lane
He's got a bag that's filled with toys for boys and girls again
Hear those sleigh bells jingle jangle, oh what a beautiful sight
So jump in bed and cover your head, 'cause Santa Claus comes tonight

[Verse 3]
Here comes Santa Claus, here comes Santa Claus, right down Santa Claus Lane
He doesn't care if you're rich or poor, he loves you just the same
Santa Claus knows we're all God's children, that makes everything right
So fill your hearts with Christmas cheer, 'cause Santa Claus comes tonight

[Verse 4]
Here comes Santa Claus, here comes Santa Claus, right down Santa Claus Lane
He'll come around when chimes ring out that it's Christmas morn' again
Peace on Earth will come to all if we just follow the light
So let's give thanks to the lord above, 'cause Santa Claus comes tonight

[Verse 1]
Here comes Santa Claus, here comes Santa Claus, right down Santa Claus Lane
Vixen and Blitzen and all his reindeers pulling on the reins
Bells are ringing, children singing, all is merry and bright
Hang your stockings and say your prayers, 'cause Santa Claus comes tonight1EmbedShare URLCopyEmbedCopy"
57,7dvkUNutBgT1tw41tpvpUh,7,Winter Wonderland,0.676,0.412,0.0347,0.0,124.891,0.0926,0.077,0.07,0.853,"Sleigh bells ring, are you listening
In the lane, snow is glistening
A beautiful sight
We're happy tonight
Walking in a winter wonderland

Gone away is the bluebird
Here to stay is a new bird
He sings a love song
As we stroll along
Walking in a winter wonderland

In the meadow we can build a snowman
We'll pretend that he is Parson Brown
He'll say ""Are you married?""
We'll say ""No man""
But you can do the job
When you're in town

Later on, we'll conspire
As we dream by the fire
To face unafraid
The plans that we've made
Walking in a winter wonderland

In the meadow we can build a snowman
We'll pretend that he is Parson Brown
He'll say ""Are you ready?""
We'll say ""No man""
But you can do the job
When you're in town
Later on, we'll conspire
As we dream by the fire
To face unafraid
The plans that we've made
Walking in a winter wonderland
Walking in a winter wonderland
Walking in a winter wonderlandEmbedShare URLCopyEmbedCopy"
58,0YupMLYOYz6lZDbN3kRt7A,72,I'll Be Home,0.557,0.366,0.0255,9.16e-06,84.829,0.9981,0.009,0.307,0.683,"[Verse 1]
Santa called to make sure I'm prepared
He said, ""Winter love is spreading everywhere""
Summer came and took off with the Spring
So now we start the Christmas caroling
I'll find my way back home
And light up every tree
We will hang our stockings for you and one for me
'Cause Santa called to make sure I'm prepared
He said, ""Pack your bags and tell them you'll be there""

[Chorus]
I'll be home with my love this Christmas
I promise, I promise
I'll be home with my love this Christmas
I promise, I promise I'll be home
Home, I'll be home
(I'll be home)

[Verse 2]
Santa called to make sure I'm prepared
He said, ""Wrap the gifts with all your love and care""
The wind, it blows the snow up in the sky
But I won't let the wind delay my flight

[Chorus]
I'll be home with my love this Christmas
I promise, I promise
I'll be home with my love this Christmas
I promise, I promise I'll be home
I'll be home, I'll be home
I promise, I promise
I'll be home, I'll be home
(I'll be home)
[Bridge]
Santa called to make sure I'm prepared
He said, ""Pack your bags and tell him you'll be there""

[Chorus]
I'll be home with my love this Christmas (I'll be home)
I promise, I promise
I'll be home with my love this Christmas (I'll be home)
I promise, I promise I'll be home
I'll be home, I'll be home, oh

[Outro]
I'll be home with my love this Christmas
I promise, I promise I'll be home1EmbedShare URLCopyEmbedCopy"
59,6C81GGUCNbEmR8gMIi0CpH,7,You Make It Feel Like Christmas ,0.515,0.876,0.0603,0.0,185.967,0.9986,0.019,0.351,0.63,"[Intro]
Ooo, Ooo

[Verse 1: Blake & Gwen]
I want to thank the storm that brought the snow
Thanks to the string of lights that make it glow
But I want to thank you baby
You make it feel like Christmas

It barely took a breath to realize
We’re going to be a classic for all time
I want to thank you baby
You make it feel like Christmas

[Pre-Chorus: Blake & Gwen]
Sweet gingerbread made with molasses
My heart skipped and I reacted
Can’t believe that this is happening
Like a present sent from God
Sleigh bells singing Hallelujah
Stars are shining on us too

[Chorus: Blake & Gwen]
I want to thank you baby
You make it feel like Christmas
[Verse 2: Blake]
Thought I was done for, thought that love had died
But you came along, I swear you saved my life
And I wanna thank you baby
'Cause you make it feel like Christmas

[Pre-Chorus: Blake & Gwen]
Sweet gingerbread made with molasses
My heart skipped and I reacted
Can’t believe that this is happening
Like a present sent from God
Sleigh bells singing Hallelujah
Stars are shining on us too

[Chorus: Blake & Gwen]
I want to thank you baby
You make it feel like Christmas

[Bridge: Gwen & Blake]
I never thought I’d find a love like this
But I found forever in that very first kiss
I want to thank you baby
You make it feel like Christmas
Oooh, (thank you baby)

[Outro: Blake & Gwen]
I want to thank you baby
You make it feel like Christmas1EmbedShare URLCopyEmbedCopy"
60,2nMZx7QHerfo4Wv37xNUEC,67,Wrapped in Red,0.54,0.734,0.0366,0.0,123.877,0.8106,0.047,0.074,0.879,"[Verse 1]
Everybody's happy
Snow is falling down
Prayers are being answered
Miracles all around
From afar I've loved you
But never let it show
And every year another
December comes and goes

[Pre-Chorus]
Always watching
Never reaching
But...

[Chorus]
This Christmas
I'm gonna risk it all
This Christmas
I'm not afraid to fall
So I'm at your door with nothing more
Than words I've never said
In all this white, you'll see me like
You've never seen me yet
Wrapped in red (ooh-ooh-ooh-ooh)
[Verse 2]
Blue is where I've been
Green can't buy me you
Silver bells remind me
That mistletoe's for two
So I found a color
That only tells the truth
That paints a picture
Of how I feel for you

[Chorus]
This Christmas
I'm gonna risk it all
This Christmas
I'm not afraid to fall
So I'm at your door with nothing more
Than words I've never said
In all this white, you'll see me like
You've never seen me yet
Wrapped in red (ooh-ooh-ooh-ooh)

[Bridge]
I'll never feel you
If I don't tell you

[Chorus]
This Christmas
I'm gonna risk it all
This Christmas
I'm not afraid to fall
So I'm at your door with nothing more
Than words I've never said
In all this white, you'll see me like
You've never seen me yet
Wrapped in red (ooh-ooh-ooh-ooh)1EmbedShare URLCopyEmbedCopy"
61,10JBIfvldDR2TnT5sphGc2,0,Shake up Christmas,0.492,0.828,0.0662,0.0,81.409,0.9985,0.067,0.224,0.709,"[Intro]
Ho, ho, ho
Shake up the happiness, wake up the happiness
Shake up the happiness
It's Christmas time

[Verse 1]
There's a story that I was told
And I wanna tell the world before I get too old
And don't remember it, so let's December it
And reassemble it, oh yeah

[Pre-Chorus]
Once upon a time in a town like this
A little girl made a great big wish
To fill the world full of happiness
And be on Santa's magic list

[Chorus]
Shake it up, shake up the happiness
Wake it up, wake up the happiness
Come on y'all
It's Christmas time
Shake it up, shake up the happiness
Wake it up, wake up the happiness
Come on y'all
It's Christmas time
Ho, Ho, Ho
Ho, Ho, Ho
It's Christmas time
[Verse 2]
At the same time miles away
A little boy made a wish that day
That the world would be okay
And Santa Claus would hear him say:
""I got dreams, and I got love
I got my feet on the ground, and family above
Can you send some happiness with my best to the rest
Of the people of the East and the West and
Maybe every once in a while you
Give my grandma a reason to smile
'Tis the season of smile
It's cold but we'll be freezing in style

[Pre-Chorus]
Let me meet a girl one day that
Wants to spread some love this way
We can let our souls run free and
She can open some happiness with me""

[Chorus]
Shake it up, shake up the happiness
Wake it up, wake up the happiness
Come on y'all
It's Christmas time
Shake it up, shake up the happiness
Wake it up, wake up the happiness
Come on y'all
It's Christmas time
[Bridge]
I know you're out there, I hear your reindeer
I see the snow where your boots have been
I'm gonna show them, so they will know then
Their love will grow and they believe again

[Chorus]
Shake it up, shake it up, shake up the happiness
Wake it up, wake up the happiness
Come on y'all
It's Christmas time
Shake it up, shake up the happiness
Wake it up, wake up the happiness
Come on y'all
It's Christmas time
Ho, ho, ho
Ho, ho, ho
It's Christmas time (Ho, ho, ho)
Shake it up, shake up the happiness (Ho, ho, ho)
Wake it up, wake up the happiness (Ho, ho, ho)
Come on y'all
It's Christmas time (Ho, ho, ho)
Shake it up, shake up the happiness (Ho, ho, ho)
Wake it up, wake up the happiness (Ho, ho, ho)
Come on y'all
It's Christmas time
[Outro]
Ho, ho, ho
Ho, ho, ho
Ho, ho, ho
It's Christmas time1EmbedShare URLCopyEmbedCopy"
62,4hrQGaFalrGJfcsILMxjuc,73,Last Christmas,0.54,0.235,0.0458,0.0,119.766,0.997,0.079,0.18,0.741,"[Intro]
Ah, aha
Ooh, ohh
Ohh

[Chorus]
Last Christmas, I gave you my heart
But the very next day, you gave it away
This year, to save me from tears
I'll give it to someone special
Last Christmas, I gave you my heart
But the very next day, you gave it away (You gave it away)
This year, to save me from tears
I'll give it to someone special (Special)

[Verse 1]
Once bitten and twice shy
I keep my distance, but you still catch my eye
Tell me, baby, do you recognize me?
Well, it's been a year, it doesn't surprise me

[Verse 2]
""Merry Christmas"" I wrapped it up and sent it
With a note saying, ""I love you"", I meant it
Now I know what a fool I've been
But if you kissed me now, I know you'd fool me again
[Chorus]
Last Christmas, I gave you my heart
But the very next day, you gave it away (You gave it away)
This year, to save me from tears
I'll give it to someone special (Special)
Last Christmas, I gave you my heart
But the very next day, you gave it away
This year, to save me from tears
I'll give it to someone special (Special, oh)
Oh, oh, baby

[Verse 3]
A crowded room, friends with tired eyes
I'm hiding from you and your soul of ice
My God, I thought you were someone to rely on
Me? I guess I was a shoulder to cry on

[Verse 4]
A face of a lover with a fire in his heart
A man under cover but you tore me apart
Ooh-hoo
Now I've found a real love, you'll never fool me again

[Chorus]
Last Christmas, I gave you my heart
But the very next day, you gave it away (You gave it away)
This year, to save me from tears
I'll give it to someone special (Special)
Last Christmas, I gave you my heart
But the very next day, you gave it away
This year, to save me from tears (Ohh)
I'll give it to someone special (Special)
[Verse 4]
A face of a lover with a fire in his heart (I gave you my heart)
A man under cover but you tore him apart
Maybe next year
I'll give it to someone, I'll give it to someone special
Special...
Someone, someone, I'll give it to someone, someone special

[Outro]
Who give me something in return
I'll give it to someone—
Hold my heart and watch it burn
I'll give it to someone—

I'll give it to someone—
I'll give it to someone special

I thought you were here to stay (Oh, oh)
How could you love me for a day
I thought you were someone special

Gave you my heart

I'll give it to someone—
I'll give it to someone—
Last Christmas
I gave you my heart
You gave it away

I'll give it to someone—
I'll give it to someone—

La, la
La, la, la, la, la
La, la
La, la, la, la
La, la, la, la, la, la, la13EmbedShare URLCopyEmbedCopy"
63,1sFWEpf1aPYN576LS1aa4Y,73,Silent Night,0.172,0.363,0.0343,0.0,174.903,0.9896,0.0,0.312,0.688,"[Verse 1]
Silent night, holy night
All is calm, all is bright
Round yon Virgin, Mother and Child
Holy Infant so tender and mild
Sleep in heavenly peace
Sleep in heavenly peace

[Verse 2]
Silent night, holy night
Shepherds quake at the sight
Glories stream from heaven afar
Heavenly hosts sing Alleluia
Christ the Savior is born
Christ the Savior is born

[Verse 3]
Silent night, holy night
Son of God, love's pure light
Radiant beams from Thy holy face
With the dawn of redeeming grace
Jesus Lord, at Thy birth
Jesus Lord, at Thy birth12EmbedShare URLCopyEmbedCopy"
